message_id,sender_id,receiver_id,message,is_read,previous_message_id,next_message_id,appointment_id,thread_id,created_at,updated_at
a8a773d0-50b1-468b-8450-d22219a2fe39,49371abe-3765-4052-9993-e6dbb467afb2,9f549643-5861-4cfe-b718-7b4af4f3359e,"Hi, I uploaded my lab results from Quest. When you have a chance, could you review them?",True,,,98e1ff02-25fd-48d9-956b-509f50825e7f,,2025-08-19T02:11:17.661861,2025-08-02T04:32:17.662052
c18e4ead-e0ce-492f-8440-2843ad8cf24e,b511c37c-c0f6-456a-8c5e-1cc2ab3ff6c5,d51e70d1-9aeb-4947-8aac-568be87b0ec0,"Good afternoon Kara, I've referred you to cardiology for the stress test we discussed.",True,,,,,2025-08-23T05:55:17.662403,2025-07-31T16:25:17.662426
3c05c22b-326c-4868-b6c3-b34fe0c25766,9f02deb8-9e00-46ff-88c6-f070207abbd3,8d90a3fb-b1cc-4e7e-b497-0867e1ac88f8,"Hello, I've been having chest tightness when exercising. Should I come in for an evaluation?",True,,,,bf23eb7f-8833-4fa1-880b-bbf3cb460835,2025-08-05T23:29:17.664218,2025-08-09T03:23:17.664329
4da5d7a9-ef25-401c-977e-0cd9f1db8461,2e4d0a18-4c0a-4e11-b577-2583e7f594d6,315ff24e-217b-4712-a233-5ab0033aaf2c,"Hi Deborah, the side effects you're experiencing should subside in a few days. Call if they worsen.",False,,,,,2025-08-18T11:02:17.664923,2025-08-28T11:30:17.664947
4f5c8e78-f19a-4eb1-a579-150c19cd98c3,671abe6e-ab74-4fa2-a6a2-ac56d7c63416,8ef8d13b-5d29-4a31-912e-fd0853457a5e,"Hi, I need to reschedule my appointment next week due to a work conflict. What availability do you have?",True,,,d0623734-7f32-44fe-80c8-017150a3080f,2c8148b2-fa60-424e-aed9-245924acb715,2025-08-09T15:53:17.665102,2025-08-21T23:38:17.665116
7c756cf0-9d67-47c2-97f5-1ecc4bbd4d57,cd47907b-32a0-4e09-8c1d-46f7c615c35d,846309f6-21fb-4b1f-8703-7ea07515c2ed,"Hello Tricia, I've cleared you for surgery. The surgical coordinator will contact you about scheduling.",True,,,,77f4a8b3-1eb9-4f9c-a987-e184e7c81a5b,2025-08-20T08:33:17.666074,2025-08-20T09:14:17.666170
545d042d-a3e7-4b5a-95aa-2eb1db037c0d,4e1ac853-60d8-48b7-9797-fd1b4bc00326,b5e12374-694a-48a5-8397-ae5658497069,"Hello Neil, your lab results look good overall. Your A1C has improved to 6.8%. Keep up the great work!",False,,,,,2025-07-31T12:52:17.666739,2025-08-09T12:29:17.666765
4b011f05-0a4b-4378-a02b-60bfeb277ca5,2a26cf78-0fc1-4ea5-b72e-93f1a46d1e91,5ff82930-241f-465b-8563-3d9440127cfe,"Good afternoon, I'm having trouble sleeping since stopping the ambien. Any suggestions?",False,,,235a375a-aa2f-4aff-bfa0-741a8918c65b,,2025-08-04T19:52:17.666969,2025-08-07T05:11:17.667031
8b7687f9-534a-4f2a-b040-25bd3e116954,5a6c9ba3-021d-4dcd-972f-c1e2502d823b,ee897856-e3d5-4c28-8aad-ebf663045b71,"Hi Caitlin, I've reviewed your symptoms. Let's schedule a follow-up in 2 weeks to reassess.",False,,,402b7146-b297-499b-91ee-396f31855b1a,,2025-08-03T20:42:17.667189,2025-08-16T15:40:17.667202
299b2233-0bed-4163-9a1c-3e1557d432fe,fddf99bf-e515-4a84-8b18-cec30cbee357,b887c5a1-ee09-4c7b-b734-5d0b40e8d1d2,"Hi Eric, your blood pressure is well controlled. Continue current medications and lifestyle changes.",False,,,,,2025-08-17T04:21:17.667287,2025-07-31T21:59:17.667300
66cf06ff-919c-4cb8-9819-dda2ab8ae0c2,04f7cf1e-1d20-4725-bfa6-3ff0c90fe920,46b35e25-275a-4917-bb54-451443bd353b,"Good afternoon Andrew, the specialist confirmed our diagnosis. We'll start the new treatment next week.",True,,,,,2025-07-30T00:15:17.667657,2025-08-07T08:37:17.667677
46c1e6f1-9cb2-4a94-ba51-5b14eab9ad4d,01ee257d-0ef9-4332-a893-b525440fc5bd,261822fa-7ad3-4585-be64-113f28b515ab,"Hi, I need to reschedule my appointment next week due to a work conflict. What availability do you have?",False,,,,,2025-08-02T18:45:17.668183,2025-08-11T02:01:17.668227
c2479c51-3e4d-4623-a3a5-bfdc41850abf,ec43c51d-2cfd-439d-838e-6c05608c21e4,643e8c4d-f740-4144-b31e-caf0483f4864,"Good morning Anne, I'm sending over a new prescription for your blood pressure medication.",True,,,38fa3f56-b96d-4f9c-a2cc-4965da20514c,3e221ae8-bd91-49cb-96f0-127e86837edd,2025-08-17T12:16:17.668794,2025-07-30T09:07:17.668808
d0ec10fd-e27d-442a-acb2-e1f5844f2c30,6825d9c3-ba6a-45b3-90bf-a13902c2cdfb,db00561b-afd2-4865-839c-85c37d53bd5e,"Hello Eric, the X-ray shows no fractures. Continue with rest and ice, and follow up if pain worsens.",False,,,c325f283-d3b5-4c4d-9456-4df7970f4af1,,2025-08-09T09:32:17.669174,2025-08-19T21:59:17.669201
1b43734d-8b30-433b-b08a-402ea8a4bceb,090180e4-177f-418b-b3c0-9d387fb77db1,d8827a43-675b-4b83-b101-0dadb68956d6,"Hi Dawn, your cholesterol panel shows improvement. Continue the current statin dose.",False,,,,,2025-08-14T04:11:17.669881,2025-07-30T04:06:17.669900
a78f03bc-3229-4700-a589-bacd128fba61,1996f9d5-0799-42ab-a1a3-29476e926fc4,62be23ac-9567-4fb2-8a1a-acd40ba92e2a,"Good afternoon Roberta, the specialist confirmed our diagnosis. We'll start the new treatment next week.",False,,,,,2025-07-29T22:59:17.670220,2025-08-22T11:10:17.670237
721569aa-da6b-451c-8f91-1c4c7a704798,88d85eaa-1b00-422d-a47b-6e579f34abee,c7a5a5e8-bfc0-4ff7-8880-837e75b7b6fa,"Hi Rachel, congratulations on your weight loss progress! Let's discuss adjusting your diabetes medication.",True,,,,97795b8e-c9fe-475c-a936-242fcd46969e,2025-08-02T22:29:17.670372,2025-08-15T02:08:17.670386
7e921ba8-3e59-4e3b-b663-b25bbf88afa2,7df16a1e-359e-4209-ba38-90284b037f96,a3d8c9d4-c6c4-48cc-9a1c-591c6473dd68,"Hello, I'm having some side effects from the new medication - mild nausea and dizziness. Is this normal?",False,,,,,2025-08-08T08:19:17.670612,2025-08-01T02:14:17.670629
88348553-1d36-4b48-a962-14c4e316f28d,0690fb05-60d8-47db-bef0-03092b3ab2b0,ade617d0-8e10-4758-a90a-ceedd598af25,"Dr. Dr. Dennis, my blood pressure readings at home have been higher than usual. Latest was 145/95.",True,,,,,2025-08-22T15:12:17.670700,2025-07-30T12:31:17.670712
d95cb3b1-ed7d-48cd-8ce8-e641fee0a4db,6ad9a6e4-425a-40bf-b874-9cc701806d8d,fa6de250-052b-414b-af44-ed55a9c85d18,"Hello, my insurance approved the MRI. When would be the best time to schedule it?",False,,,,,2025-08-25T00:57:17.670990,2025-08-05T03:45:17.671011
83faaa23-470c-40ad-930c-3a5b3a0c2d52,fce3727f-d189-4606-8f2b-dc64781e4256,bbae4049-8e1e-499e-bcd3-3402e3ea72c1,"Hello Rebecca, your mammogram results are normal. Schedule your next screening in one year.",False,,,,,2025-08-28T06:08:17.671157,2025-08-18T09:24:17.671171
73e24d2a-2486-44d8-ae87-6dcff3866571,dd6e465c-9a0b-4c68-adc3-057f27827595,aca2cb1e-9624-436e-9b85-5395b96aee73,"Good afternoon Kristen, I've referred you to cardiology for the stress test we discussed.",True,,,,,2025-08-18T04:39:17.671249,2025-08-20T02:28:17.671260
d16ea1d4-d7e9-4d43-af60-3779c2206c48,05366a3c-31f4-4ec1-bcdf-112bf1626b56,17b264a2-11d5-43d5-8ca7-5746d3707ff3,"Hello, I've been having chest tightness when exercising. Should I come in for an evaluation?",False,,,1dde4c96-3ed7-4045-a2b4-6d5d3c8fba4c,,2025-08-23T17:08:17.671364,2025-08-21T11:01:17.671378
bd4eb20c-9a1a-4044-a875-e70719e88b0e,0cfbf66c-0eb7-4341-9e12-0bd57cf905ea,9e57d432-11e5-44f5-8a35-456514d9b0bc,"Hello Johnny, the X-ray shows no fractures. Continue with rest and ice, and follow up if pain worsens.",True,,,7330efcf-771f-45e0-9c9c-9524baf5846a,7b2cddf1-eb72-4ed7-9b1d-1bc76f09d0d6,2025-08-28T05:43:17.671492,2025-08-05T20:59:17.671529
c02aa2fb-9b80-4246-9982-206fa5f446d3,5fc390ef-c419-4209-86d3-8355206248eb,ffc72743-5843-44b7-8ae0-46260ae40280,"Good morning Jessica, the CT scan was normal. I'm glad we could rule out any serious issues.",False,,,4c0d45f7-327f-4323-ae02-931c32f773ff,,2025-07-29T14:33:17.671665,2025-08-03T11:41:17.671674
309941a8-eba9-47ee-ad92-5dd48ab83aef,144e9012-2564-46a7-a3ce-28eaeaa021bf,5bd60e1c-a321-4849-bd36-658870070f4f,"Hi Elizabeth, your blood pressure is well controlled. Continue current medications and lifestyle changes.",False,,,,70b133c4-f00f-4d2c-ab53-b763a232f22a,2025-08-19T09:51:17.671892,2025-08-03T20:59:17.671913
060cb18c-81d0-4711-bea0-8b0db43730fa,0e39f7bc-9aa9-438f-8a2b-9fdae9292526,8aca43cb-12d9-4e77-be2a-4640d96812c6,"Good afternoon Amanda, I've referred you to cardiology for the stress test we discussed.",False,,,,f961de56-02c3-4d24-adc0-e001fa4d74b7,2025-08-13T03:04:17.672062,2025-08-26T17:28:17.672078
403ab46b-ffd5-49d5-8f0b-29d82b6ddd31,c6677a0a-cc26-48db-bcc2-a223e87fa500,a4251e35-2390-425f-9aff-6daf154223d7,"Good afternoon, I wanted to follow up on our discussion about my sleep issues. The CPAP isn't helping much.",True,,,10e6fc6a-db5c-434f-860f-d77019dc07af,,2025-08-26T00:07:17.672199,2025-08-26T04:23:17.672213
a9c5e779-a30c-47b0-bf84-1a1b406c7f31,6ce92b49-5c5f-4038-a4e8-687f5ae0d8fc,368c5578-da40-4f12-82b5-93203bfc2bc1,"Hello Sarah, the X-ray shows no fractures. Continue with rest and ice, and follow up if pain worsens.",True,,,af1dfa53-f91a-4301-a6f5-abedbb7dbdc4,1ef7602b-a258-46b9-90ea-8722e2bad482,2025-08-22T00:06:17.672584,2025-08-02T06:53:17.672597
26f65d38-58c7-44b7-86ed-c204ac95ac36,51d02581-1add-4b88-a81c-3571509a30ab,8ff1f532-7a2f-4ade-a5e2-b4e1daf2a387,"Hello, I've been having chest tightness when exercising. Should I come in for an evaluation?",False,,,1dd8fb97-b570-4c43-919c-a31e786bce90,,2025-08-13T00:22:17.673046,2025-08-05T08:48:17.673128
1d8d25d3-3400-410f-a885-a0ed2d1b83b0,66a32fb6-21f8-44ce-bb2c-c36c94475777,203fc5f0-fbc7-4e64-8767-149982944fd5,"Hi, I wanted to let you know that the physical therapy is really helping with my back pain.",False,,,,,2025-08-27T06:15:17.673769,2025-08-03T23:37:17.673832
c1c85766-fa0c-4620-9a14-25f452a123ab,486b9222-d28d-4efc-acf8-06f9d4518fb6,f4fac32c-15c7-4bc9-891a-44e71214d949,"Hi Jennifer, congratulations on your weight loss progress! Let's discuss adjusting your diabetes medication.",True,,,,,2025-08-01T18:41:17.674217,2025-08-28T05:57:17.674236
aff8a59d-58a8-4bb8-9845-5c275b2bdc51,63ff8db4-50c5-4246-ae93-563bd87c9f7a,81a7e8d5-580a-487e-a302-09a481139482,"Hello Nicole, your blood work shows slightly low vitamin D. I'm prescribing a supplement.",False,,,8130a849-787b-4804-80be-be86f0f2b622,,2025-08-02T14:54:17.674584,2025-08-08T15:58:17.674606
39764265-fa6f-4e97-99a8-cb4ddec00630,2af9d1ed-c995-4863-a692-5c56fcdf2c1c,13eabeb8-07e9-408b-95a6-fcd7b9f74633,"Hello, I've been having chest tightness when exercising. Should I come in for an evaluation?",True,,,,0ea6e9e5-6803-4ff7-bc19-fbc06b0b7d1a,2025-08-07T10:30:17.674785,2025-08-07T02:12:17.674809
a645a520-f985-4e25-9dcb-01f05a98c5ab,60bd70b7-1595-4b9b-a3a6-c7085435b2be,9f964e6c-7ef5-4710-91a3-b20f6870b23c,"Good morning Russell, the CT scan was normal. I'm glad we could rule out any serious issues.",False,,,,,2025-08-18T03:51:17.675265,2025-08-02T04:24:17.675315
e9f88669-4f63-4f32-881b-400c019e2fdd,2af72086-0a0e-4312-8dd9-a000c55caed8,1be5b698-223f-4e71-8dc7-b47c97025285,"Hello, my insurance approved the MRI. When would be the best time to schedule it?",True,,,00de3186-21a5-4b75-af90-007e1d196f1f,,2025-08-18T01:13:17.675498,2025-08-27T04:28:17.675515
f42bbe69-232e-4014-a56e-7cc244e30a17,4bfec0f4-3690-4d4d-a1f7-ebebd0728d59,aa1a40ef-0204-4e6e-ae64-de20f620a867,"Hi Courtney, your cholesterol panel shows improvement. Continue the current statin dose.",False,,,b280173d-18cf-44cc-8960-044beef5a349,26e3dd19-76a9-4a81-a890-37874134d44b,2025-07-29T22:35:17.675850,2025-08-24T06:38:17.675867
09454588-f5a4-45aa-9fed-5f6b37d65c2a,e3ce5213-4cb2-43a0-bcbe-8c78f05846ad,2879789e-6a89-4ce6-81f3-0979b7e83978,"Dr. Dr. Cunningham, my blood pressure readings at home have been higher than usual. Latest was 145/95.",False,,,,,2025-08-14T22:57:17.676460,2025-08-15T06:39:17.676480
4b631397-7671-48d2-a8f4-9d0bbdf91da4,c3a60ed3-4bc4-4402-9d1c-bea3bce33c6f,4da6c945-ec94-45a5-b1ab-eac8da7d258c,"Good afternoon, I wanted to follow up on our discussion about my sleep issues. The CPAP isn't helping much.",False,,,a588712e-d37b-40f2-bce6-9b0893997a2c,,2025-08-09T03:52:17.676597,2025-08-08T05:16:17.676613
22758f80-1222-42b6-94d5-d6cac851e033,1a9cb5c6-a8a8-40f6-a2f3-5782c99ac372,9add625a-4312-48fa-b336-00dd83f2f79b,"Good morning Dr. Dr. Estrada, I've been experiencing increased fatigue lately. Should I be concerned?",False,,,,,2025-08-27T04:55:17.676857,2025-08-22T12:49:17.676876
5f27471d-84f8-4266-8fd3-43a25733bcaf,e4a99021-e332-400c-ba88-701afaf43ed7,efbb349a-de84-4976-bfcb-e20c151d6254,"Hello Kyle, your blood work shows slightly low vitamin D. I'm prescribing a supplement.",True,,,31603c38-e212-4f54-b589-b2e9ec6017e4,,2025-08-28T13:15:17.676971,2025-08-23T03:10:17.676988
bd0a359b-fcd7-4dcc-b363-f46c2425b774,733fbd1c-b98d-42ba-bec5-995d10ca4c9b,6b744851-2a31-4809-957e-d087580b735c,"Hello, my insurance approved the MRI. When would be the best time to schedule it?",False,,,,4bc7b24c-a216-4e2d-a9be-6573ae6f4f15,2025-08-14T13:05:17.677265,2025-08-27T22:04:17.677363
7f0f96e2-33d1-42c9-8c4e-34a0bdf20f41,1e9263ac-4f0a-4459-af2a-5b769605a794,f2d17f56-caeb-4416-b876-9fdcf473e747,"Hello Caitlin, your mammogram results are normal. Schedule your next screening in one year.",True,,,9df1a743-cec6-4d3b-8c89-3b646cd54ed0,,2025-08-04T11:50:17.680205,2025-08-13T05:07:17.680354
053a9fc2-b6c6-4893-9773-16f275076765,10622f0a-2ed5-4ba4-88bc-fca0a35261c3,446578ab-3897-4a32-b412-96d007e40f68,"Hi Katherine, I've reviewed your symptoms. Let's schedule a follow-up in 2 weeks to reassess.",True,,,b607eb67-bf24-4d04-a27c-61eb0e4f0732,,2025-08-24T19:59:17.681137,2025-08-11T04:09:17.681161
f21ad1bd-a2c1-46f2-9b36-fb09c18d29c2,3e3764a6-9f0b-406d-9f27-9f4b802ca249,1fdabe65-b47b-4dca-8981-464891fad2e5,"Dr. Dr. Robinson, my blood pressure readings at home have been higher than usual. Latest was 145/95.",True,,,,d407a6bc-700e-4d40-8cf5-d14d4fea0e0f,2025-08-20T16:14:17.681886,2025-08-05T07:45:17.681909
2c518aca-209e-466a-8e67-a821f03d873c,e9e1d0bd-55a3-4003-89df-56db405cb23c,ee9a385a-0183-4d51-806e-975bcdd72825,"Hi, I need to reschedule my appointment next week due to a work conflict. What availability do you have?",False,,,d2bf5e1a-61d0-43e8-8758-9a67744b947d,,2025-08-17T16:44:17.682899,2025-08-07T08:34:17.682929
6d62c346-b99c-4bc8-9b91-6b0b4a0cfd6a,98c97ea2-0ad2-4f98-8507-c74c38395d18,ea57282b-a513-4f53-bce8-6191b8776dba,"Hello, I've been having chest tightness when exercising. Should I come in for an evaluation?",False,,,,,2025-08-28T01:01:17.683180,2025-08-17T11:13:17.683200
798d3b10-ad5d-4781-8813-2df998004dd8,6333cc01-1dd4-4e4b-9bd2-32eb375bb571,8f66a28c-616c-4bba-9ff2-c4ccaf1c2dfc,"Hello Johnny, your lab results look good overall. Your A1C has improved to 6.8%. Keep up the great work!",True,,,b428049f-d2d3-4064-9e6d-e0308959514f,a0d20378-f823-497a-9345-b0767a8e0b3d,2025-08-14T19:45:17.683352,2025-08-27T04:59:17.683369
3a5d81ed-e958-438b-a9ec-b2ac65f191aa,98dcab20-14aa-4e51-9fb8-bc02587f5ee3,bc81f942-be94-4c2e-b3a5-99c024d4f1ca,"Hello Yvonne, your mammogram results are normal. Schedule your next screening in one year.",True,,,,,2025-08-10T17:33:17.683488,2025-08-11T21:39:17.683506
2c04ee57-c35e-4574-8ddd-5682592cb6f6,671abe6e-ab74-4fa2-a6a2-ac56d7c63416,802713bb-2619-43ca-a85d-b4768a6cc0bb,"Hi Dr. Dr. Craig, my pharmacy says they need a new prescription for my Lisinopril. Can you send it over?",False,,,,,2025-07-30T16:16:17.683607,2025-08-24T02:51:17.683624
ca0b0628-97e4-4579-8bae-6e71b442160b,493e6fa7-708d-4bcb-89b4-515f4b561352,c6f08266-ecaf-470e-984d-ca413209b46d,"Hello Tracy, the X-ray shows no fractures. Continue with rest and ice, and follow up if pain worsens.",True,,,,0ba1be15-72da-4d11-8ef8-97b0b27296d9,2025-08-27T09:17:17.683707,2025-08-13T07:02:17.683724
4c968ffd-6411-4773-973d-c0bdc463b11f,a61f9e13-3fe1-4584-a1e9-2424a33034f0,89473cb3-e72c-4fdf-a4eb-c0a3ab294b3d,"Hello Christopher, your blood work shows slightly low vitamin D. I'm prescribing a supplement.",True,,,c8e69559-ae32-4467-a5ff-2c5ed5e530cc,,2025-08-02T11:08:17.683810,2025-08-16T12:58:17.683901
f3dca7f8-3973-49ac-b9e0-8ea704639d32,044f2016-7aa0-43c3-989b-e6ff44e2642a,090180e4-177f-418b-b3c0-9d387fb77db1,"Hello, my insurance approved the MRI. When would be the best time to schedule it?",False,,,,,2025-07-28T14:45:17.684153,2025-08-05T04:25:17.684184
4ece3c2f-990d-4da3-bdca-d87730d6f3f9,7efb5ff8-12ed-4fb0-8bd3-3e1ed503f98b,6f9a7923-28ed-4bf9-9f59-f49b28da5f2e,"Good afternoon Jade, the specialist confirmed our diagnosis. We'll start the new treatment next week.",False,,,9e22f3cc-888a-4372-8092-2561f06e1d56,6baa752b-475d-4704-8caa-11c2bb3f816a,2025-08-08T14:48:17.684689,2025-08-20T23:38:17.684715
43e7d262-93ad-4114-857c-44f3fb2ba0a1,70112b91-2c0f-439a-8402-fb55d145260d,279ca10a-2377-4ef9-8f19-a5178e1d4381,"Good afternoon, I wanted to follow up on our discussion about my sleep issues. The CPAP isn't helping much.",True,,,,,2025-08-28T14:04:17.684824,2025-08-22T20:07:17.684977
a47c3cc1-3a3c-44cf-bb66-9419e9d76a5c,ee897856-e3d5-4c28-8aad-ebf663045b71,398eb9de-be3e-41fb-9861-bf6539119acd,"Hello, I've been tracking my glucose levels as you suggested. They're ranging from 110-140. Is this okay?",False,,,,debcb3cd-d8aa-4a84-8925-e99d292bc7ce,2025-08-26T16:07:17.685236,2025-08-12T14:45:17.685271
c1d17079-c3b7-4862-8c7a-1b7264f61168,5c20fbd8-edb3-4d89-a8c6-45b78633f81f,be212fda-08b2-4786-9850-f8fc6f0ed228,"Good morning, I'm traveling next month and need refills on my medications before I leave.",True,,,,,2025-07-29T10:20:17.685849,2025-08-14T06:52:17.685904
05e9577b-4f0b-4e5b-9293-ddd1c9dadc0e,c9e8b98f-0173-4351-87f4-c2fc585a408f,b2fd7bdf-f932-4e68-8468-2ee7fc9fc4f4,"Hello, I've been tracking my glucose levels as you suggested. They're ranging from 110-140. Is this okay?",False,,,951039ea-680b-40f8-b794-f068af02bb07,,2025-08-14T12:15:17.686131,2025-08-23T19:32:17.686172
1eacf45b-f1e4-403f-bfde-980b949a8b53,07fe32b7-2586-4bf7-8823-3a2019212c61,9c98221b-d033-4fb2-b306-c8132d6cd3ca,"Hello Donna, your blood work shows slightly low vitamin D. I'm prescribing a supplement.",True,,,5e695101-aef2-4bcb-a4ba-7fe443c776ee,bfca872a-598c-4d39-839e-4597391a0747,2025-08-15T22:27:17.686647,2025-08-04T04:35:17.686709
69f5495b-90ed-41d7-817e-5a9ba0410cd8,3a24b2df-e7d5-4052-b611-deb6cf9c514a,51d02581-1add-4b88-a81c-3571509a30ab,"Good morning Jacob, I've updated your treatment plan based on today's visit. Check the portal for details.",True,,,,,2025-08-23T17:59:17.687191,2025-08-25T20:49:17.687233
a54e0276-7d32-4431-98c1-341ca944567b,b2fd7bdf-f932-4e68-8468-2ee7fc9fc4f4,eabdc465-af58-469c-b14b-3ec4a8e4200a,"Hi Judy, congratulations on your weight loss progress! Let's discuss adjusting your diabetes medication.",True,,,edcf8055-26bc-4905-bf53-224df1576e7d,cff2f8db-56f4-4304-af73-e34858694249,2025-08-17T08:36:17.687530,2025-08-08T02:56:17.687557
38814f79-c151-4658-966a-bbbd489132b1,234b6545-f19b-4ebc-8fe5-59fdc8e96b6b,81556428-ba58-4d75-843d-c8ab8451d21a,"Hello, I've been tracking my glucose levels as you suggested. They're ranging from 110-140. Is this okay?",False,,,,,2025-08-12T01:52:17.687694,2025-07-31T10:30:17.687714
dd47ab78-3387-4bc9-9d7a-6dd69e5d96f7,68932ddb-0658-4065-ac02-8dc0d0f0e50a,52b98a49-8a27-4a05-9930-d5f1ee842fbb,"Hello, my insurance approved the MRI. When would be the best time to schedule it?",True,,,,,2025-08-06T06:42:17.687763,2025-07-30T04:11:17.687779
cd6cffae-b054-48ff-8260-f209aa987eea,f451dea9-be78-4c06-adc6-97c533d32901,a4f6db81-a898-4fbe-8851-6e4c1720a967,"Hi Angela, I've reviewed your symptoms. Let's schedule a follow-up in 2 weeks to reassess.",True,,,,,2025-08-03T04:40:17.687899,2025-08-03T21:39:17.687914
a1aaf37c-9c55-4b54-87e5-b83739bdbe3a,1447cb53-6ade-4a40-9d8b-b74ef34a1d72,a91fbe14-0e44-42fb-9a22-4d9460e4366d,"Hi Michelle, your cholesterol panel shows improvement. Continue the current statin dose.",True,,,b9f9bbbc-e9cf-4ea2-9a4d-65037d1d452f,c41625e8-79c3-48ea-810c-2b47e0a14e0f,2025-08-01T22:03:17.688054,2025-07-31T03:27:17.688145
d77b8b52-bb63-4a55-928f-e82a37f9507c,3a0693cf-4bf6-4eda-bb93-ec74fbce8eea,34f5171e-6173-4a20-8480-4e557ab39bbf,"Hi Nancy, the side effects you're experiencing should subside in a few days. Call if they worsen.",False,,,,48931d85-c679-450a-8430-be654c6f0a22,2025-08-15T00:58:17.688413,2025-08-03T17:06:17.688426
681a9bbc-62d6-4001-92c2-10af27aa740c,7824324d-d558-4753-9742-ab1202a889f6,c12376d7-9495-49ce-98e2-44c8f7d83766,"Hi Zachary, your cholesterol panel shows improvement. Continue the current statin dose.",False,,,c2eaf638-05f8-4075-8435-0b4e385b48e6,,2025-08-02T16:59:17.688634,2025-08-26T20:38:17.688773
f6783744-54dd-4022-8d25-f3592524db75,6606f452-8bd2-4dcf-bb38-5118590d8be3,beb5f37a-9225-4a00-adb4-37b64a4dcef7,"Hello, I'm having some side effects from the new medication - mild nausea and dizziness. Is this normal?",True,,,,,2025-08-22T01:19:17.689562,2025-08-01T13:40:17.689593
349f4d7b-4208-4914-ac88-81907fd78650,6c04eb6b-4d5a-489f-bf54-f4b233626f07,a450ed29-cdf9-4a88-8fcc-c506c8be2455,"Hello Christina, your mammogram results are normal. Schedule your next screening in one year.",True,,,,,2025-08-11T08:46:17.689850,2025-08-12T12:28:17.689866
b46dcfe7-3577-4ef0-96ca-cd0c5d231177,1bd1cecf-aea4-47dc-a519-65e83ca96be9,34f5171e-6173-4a20-8480-4e557ab39bbf,"Good afternoon Nancy, I've referred you to cardiology for the stress test we discussed.",True,,,,fa7c4ac6-0e00-4dd9-95a5-fef1e1c63ea2,2025-08-06T17:08:17.689993,2025-08-04T07:24:17.690011
af783044-9c30-49ca-b203-76035d55a8a7,7233228b-8e02-4fa2-98f8-29cbbedfa44a,81e28c37-0425-4047-8086-b28f3e022fa6,"Hello Bianca, your lab results look good overall. Your A1C has improved to 6.8%. Keep up the great work!",False,,,043b5fb7-baf9-441c-99e1-e1242a7fcfd1,7773ca1a-04d6-4e5f-b4a8-d48da1623f5e,2025-07-29T00:40:17.690550,2025-08-23T02:01:17.690579
ba73008f-a41d-410e-acf2-904af31593fa,54e82182-e545-4a66-96ab-b92698e64694,f905c6e6-1ab5-4d3c-9f44-48c7df64fa61,"Good afternoon, I wanted to follow up on our discussion about my sleep issues. The CPAP isn't helping much.",True,,,,c3d2e6c4-a4ec-4f70-a92e-0f3ef515e29f,2025-07-31T17:30:17.690673,2025-08-08T01:48:17.690693
77326c02-03ef-4377-904d-45d3a4e9e831,c04a21b2-f4fe-4025-a3c4-f4eea7af5fa2,e25f367f-945a-45d8-906d-6bb2f3253d83,"Hi Geoffrey, congratulations on your weight loss progress! Let's discuss adjusting your diabetes medication.",True,,,180dc7ee-3760-4c2f-afcb-fd346d4f3394,6d6e78e1-4cf0-4511-8cb2-7a71a75fb3da,2025-08-02T08:03:17.690876,2025-08-24T10:35:17.690897
efac7568-e170-48d7-9543-8cb8bb861974,9dc9ca1f-0fcf-4334-9c72-0b547a093719,578514ba-65b3-4cb6-aa8c-f3336a9394a5,"Good morning Nicole, the CT scan was normal. I'm glad we could rule out any serious issues.",False,,,f44c8b98-f6cc-49e6-8a84-ffc473866bb4,,2025-08-19T09:13:17.692107,2025-08-20T19:55:17.695077
36bf5609-6c52-468a-9f4f-3a5a42417c4c,dfef30bb-8b73-4c11-8502-2820c8899d50,0e39f7bc-9aa9-438f-8a2b-9fdae9292526,"Hi Dr. Dr. Foley, my pharmacy says they need a new prescription for my Lisinopril. Can you send it over?",False,,,,fd00735d-6557-4c91-bde5-48d91ecaad97,2025-08-26T07:09:17.700367,2025-08-14T22:29:17.700512
667a83ed-0d42-4aa1-aa59-0dec2f359f7d,22c67bee-a13e-430e-9e55-5300228b659d,34afba92-8462-4db1-b069-e34fcdc5fab0,"Hi, I wanted to let you know that the physical therapy is really helping with my back pain.",True,,,,,2025-08-10T16:03:17.700743,2025-08-01T04:18:17.700758
ea6fc85d-8564-4201-ac58-516b543cb104,a9f3a679-b767-482b-b634-e6c42a450505,2fb2b45b-6af7-4eee-b0dd-3abbf398b76b,"Good morning Charles, the CT scan was normal. I'm glad we could rule out any serious issues.",True,,,,,2025-07-30T13:58:17.700949,2025-07-28T15:46:17.701051
205d08a4-3a64-4ff2-bc55-17673dcb980b,3ee44bcb-db1d-4698-ac6d-341e446a6faa,c04a21b2-f4fe-4025-a3c4-f4eea7af5fa2,"Hi, I wanted to let you know that the physical therapy is really helping with my back pain.",False,,,,,2025-08-25T21:44:17.701622,2025-08-16T07:00:17.701645
e16c0de2-ce07-46d2-8270-3422fdfb4d9b,1148f7d3-3748-4020-9ef0-f19fae893a33,2e5433d9-2302-44f3-ba13-e405800f0e04,"Hello Brian, your mammogram results are normal. Schedule your next screening in one year.",True,,,,,2025-08-03T23:36:17.702172,2025-08-24T15:23:17.702195
a30885f4-a4fa-435f-b8f4-0ed96b27ebc4,3c66a3e9-b9c2-4bf8-a5a1-f04c3bec5d24,cdeaf1d4-5f2f-4529-881b-7b7257ab7a94,"Hi Mark, your blood pressure is well controlled. Continue current medications and lifestyle changes.",True,,,1a5a1c92-ff24-4090-9194-7ec5117fb389,,2025-08-18T22:05:17.702298,2025-08-06T12:20:17.702320
e4adcbe2-0118-4817-81f2-6cbf70688df7,8aa911a5-3756-49e9-9b4f-e56b0543b1a6,ea87d130-7328-4e58-8165-926cacbf7cc8,"Hi, I've been following the diet plan we discussed and lost 8 pounds so far!",False,,,,,2025-08-25T16:48:17.702404,2025-08-25T00:37:17.702420
a26b15e3-cec4-4030-b3cf-f0a9b84dbf73,f12771a5-d885-45df-a13a-9a55f2169142,63619ca7-7dc7-4ecd-b7ba-5f2df17d1334,"Good morning Timothy, I've updated your treatment plan based on today's visit. Check the portal for details.",True,,,82c6b43f-0d1c-4075-8ed3-66c7a1599762,,2025-08-06T08:42:17.702642,2025-08-08T17:41:17.702663
a7d181ce-a34b-421b-b877-47262c6cca53,400e9151-fcad-4f2e-812b-abeedab62cad,0690fb05-60d8-47db-bef0-03092b3ab2b0,"Hi Gemma, congratulations on your weight loss progress! Let's discuss adjusting your diabetes medication.",False,,,,,2025-08-04T17:56:17.702731,2025-08-11T21:01:17.702753
ed978d79-0f27-4f58-b18a-586854c6d5bc,23f0adac-d801-41fa-818f-6815c8f67834,57e672bf-f689-4c78-bc9a-532f84f75c6e,"Good morning Anna, the CT scan was normal. I'm glad we could rule out any serious issues.",False,,,0fad395a-0990-4776-9354-87f319ab8fd8,,2025-08-22T16:03:17.703115,2025-08-16T06:21:17.703151
06744af2-c76a-4508-a6a3-7cf703171bc7,8a7797a4-410c-4c73-bae6-b31033d2a108,ec43c51d-2cfd-439d-838e-6c05608c21e4,"Dr. Dr. Snyder, I'm concerned about a new mole I noticed. Can we schedule a skin check?",True,,,535b8a81-ba28-42ad-8ac1-0ddb2c111254,,2025-08-13T20:13:17.703560,2025-07-31T12:29:17.703585
c13a4c75-4770-4f77-94cc-b2de8cf097d5,f3b1b3fd-daf5-4661-ab20-65e0f245dca4,355a35ed-d11d-431d-aa32-50736edbee4d,"Hello Paige, your lab results look good overall. Your A1C has improved to 6.8%. Keep up the great work!",True,,,,af690c5d-87cc-482b-bd04-31fcf7538602,2025-08-13T18:06:17.703793,2025-08-20T18:38:17.703817
