message_id,sender_id,receiver_id,message,is_read,previous_message_id,next_message_id,appointment_id,thread_id,created_at,updated_at
3e7d560a-a210-473b-bde9-f3a1f79959da,58f1fce2-4264-4591-a391-23d583323299,e27f9340-536b-4db4-86e0-61005893e9c8,"Good afternoon, I wanted to follow up on our discussion about my sleep issues. The CPAP isn't helping much.",False,,,,,2025-07-30T08:19:17.871949,2025-08-09T08:54:17.871988
a14fb357-73b4-4818-b59f-c29c0c559f7d,eccb7bf5-e7e6-4a1d-9ade-08e901545d6f,60bd70b7-1595-4b9b-a3a6-c7085435b2be,"Hi, I need to reschedule my appointment next week due to a work conflict. What availability do you have?",True,,,dab43a0e-8654-4283-ae6a-e2ee0cf9b9cb,,2025-08-14T12:10:17.872152,2025-07-28T23:59:17.872217
bf813c4e-4e19-4133-a380-653cbe4250cf,7ce746b9-a964-44fb-8914-16406764d9d0,c9348160-30d9-4f28-838d-3d17fb0e0b78,"Hello Rachel, your blood work shows slightly low vitamin D. I'm prescribing a supplement.",False,,,,,2025-08-28T06:02:17.872311,2025-08-27T16:32:17.872336
9d69604f-0477-450e-9620-cff3f4ff1162,7a6f8c52-c294-4d59-b773-842dfdffb69f,671abe6e-ab74-4fa2-a6a2-ac56d7c63416,"Hi Stewart, congratulations on your weight loss progress! Let's discuss adjusting your diabetes medication.",True,,,f340e61a-a7fb-4dbd-a63f-0ea52bfe7201,,2025-08-04T07:44:17.872480,2025-07-29T18:47:17.872511
2b05047d-f034-4f25-a680-77eff1d6fe52,f36d8886-cf6e-4831-aea4-b190a481f40f,ce5ef971-d0d7-45b4-9ce6-a1d7fb1abfe9,"Dr. Dr. Hall, I'm concerned about a new mole I noticed. Can we schedule a skin check?",False,,,,13bbab49-ce3a-4aa0-814c-50da7e0fb211,2025-08-25T09:56:17.872874,2025-08-08T13:45:17.872932
32cb8199-b4e5-46dc-8cc0-5179855bcbe7,1624e92e-b48e-40f6-b445-ef06fc5ade37,1ff47398-411d-4f2e-a215-62e302d10383,"Hello Harriet, I've cleared you for surgery. The surgical coordinator will contact you about scheduling.",False,,,,dab17b90-eb9c-4987-acb5-e2facebb972c,2025-08-16T17:25:17.873542,2025-08-27T13:00:17.873574
a4be64df-eb06-40f6-b8e2-dfedd15c0d62,1c586a74-1cfe-485a-ab6f-08669d54096a,be960334-89f0-41eb-8960-db7f8483a236,"Hello Jamie, the X-ray shows no fractures. Continue with rest and ice, and follow up if pain worsens.",False,,,,,2025-08-16T10:45:17.873843,2025-08-01T19:39:17.873875
170f3a51-3950-4dfd-aa60-11c40776d926,e7604215-2a35-4f52-8cd2-f79d607a0a1a,e2a93de5-5d52-4075-a632-67b735219a56,"Hello, I'm having some side effects from the new medication - mild nausea and dizziness. Is this normal?",False,,,,,2025-08-10T12:15:17.874063,2025-08-08T03:13:17.874097
21b1e25e-f242-4372-8241-d3f03a258626,2c3f965a-aa23-4dd1-bf9f-591e693c69c1,40832f32-e512-4438-8095-1524ea835b53,"Hi, I've been following the diet plan we discussed and lost 8 pounds so far!",True,,,,,2025-08-09T15:33:17.874462,2025-08-15T04:58:17.874488
df536a06-144c-4ba5-b9cc-11b06709e161,fb6f075d-80c9-45de-9985-11f85bc84530,1d5a49c7-d233-4c9c-ae61-341dc0b767e3,"Hello Dawn, your mammogram results are normal. Schedule your next screening in one year.",True,,,,66b62e19-1e53-4870-a60a-716db554db73,2025-08-26T04:42:17.874793,2025-08-21T04:29:17.874814
47cf6472-6aae-4e8f-94e0-7ccd1300340b,95cb9d66-17d2-4806-a1d3-2c8dc2380603,ea3dabcb-9c0b-4b2c-bf58-ca9d4d21e2eb,"Hi, I uploaded my lab results from Quest. When you have a chance, could you review them?",False,,,,,2025-08-27T15:02:17.874942,2025-08-04T22:58:17.874959
3911aad3-4f13-4484-babc-64e75cc1a8bb,d231cf9f-4c0c-44f6-b448-53db7fbfc287,3e344c47-eb4e-4311-94a7-0ea505d87fff,"Good morning Harriet, I'm sending over a new prescription for your blood pressure medication.",False,,,fbb4565e-308b-48bf-b345-22b8edc37d57,,2025-08-14T12:19:17.875038,2025-08-01T15:14:17.875053
e5fd6ba5-336b-4665-b87d-2b14ca7206c6,422cca9c-aef8-4631-967b-356d17afe0ea,db67254f-1750-4f90-9670-ff5c7259f05c,"Hello, I'm having some side effects from the new medication - mild nausea and dizziness. Is this normal?",True,,,4b6db9d9-69b0-475a-9a42-6385ee0395eb,82ea4e1d-4103-429c-ae46-d263d2a641ed,2025-08-22T06:21:17.875171,2025-08-22T20:11:17.875189
116f831f-340e-4da5-8c84-4bff294d4624,5633b541-1177-437e-b98f-2813273c98e2,9a203424-c180-4222-9815-ded233ac2ee0,"Hi, I uploaded my lab results from Quest. When you have a chance, could you review them?",False,,,57bfd9d1-894a-42b0-aebe-c92f41cd5315,,2025-07-30T10:08:17.875362,2025-07-28T16:25:17.875388
55b3668e-be47-4052-ac01-ce49e960fe25,bc14ef25-b4a7-4c72-88f3-bec75755c7ef,6535b36d-0076-4931-bcf5-9a8f1dc218f4,"Good morning, I'm traveling next month and need refills on my medications before I leave.",False,,,2d6be46e-ead7-4631-bb8d-f46b83840abd,9af5cb7c-2dd7-4f34-8b03-666f6564370d,2025-08-14T23:01:17.875626,2025-08-05T16:01:17.875641
5e358645-1bd5-40cc-8de8-842ed0c8e94c,ea57282b-a513-4f53-bce8-6191b8776dba,90e64b4d-1c63-4c4d-b1e2-fd8523654fd3,"Hello Nicholas, your blood work shows slightly low vitamin D. I'm prescribing a supplement.",True,,,,1f2e53b0-2f0c-4e7d-b27c-c8cd8406ee86,2025-08-11T07:27:17.875949,2025-07-29T05:21:17.875986
b839cd60-c78b-48e0-9954-daebdc136627,ae59e473-874a-44be-9b84-9e709eef03ad,b5ec6332-0773-4dd2-a678-ac7fb24746ea,"Hello, my insurance approved the MRI. When would be the best time to schedule it?",False,,,,,2025-08-25T10:55:17.876234,2025-07-29T19:34:17.876259
6c165f95-0bcc-47df-9658-1af9d863ab1f,8ef8d13b-5d29-4a31-912e-fd0853457a5e,1ad0b0ac-dedd-4e61-899a-76795faa4514,"Hello Penny, I've cleared you for surgery. The surgical coordinator will contact you about scheduling.",False,,,,,2025-08-05T21:13:17.876440,2025-08-09T19:24:17.876451
da861bf7-eb82-40b0-a48b-615f020bd7e4,9a7c57fa-bac9-48f4-8615-fe4044f8415a,3322fa91-0dde-48ef-82b3-ddc12fcf7623,"Hi, I need to reschedule my appointment next week due to a work conflict. What availability do you have?",True,,,,6f6b69c1-a211-44ba-8ad5-a28f41e23f6e,2025-08-23T08:20:17.876574,2025-07-29T01:43:17.876587
0b19c690-7047-4ad9-8410-614a99e1f84b,5ebeb26b-ab00-4abc-88d9-7a0654556bb8,9ea3bb43-4676-430f-9f26-bb9560c1514f,"Hi Brandon, I've reviewed your symptoms. Let's schedule a follow-up in 2 weeks to reassess.",True,,,,,2025-08-19T08:41:17.876683,2025-08-01T03:44:17.876696
4a10374d-2f36-4c49-9933-cc39cf9c546f,9f6ab400-f255-49c9-96e4-1db026966283,13eabeb8-07e9-408b-95a6-fcd7b9f74633,"Good morning, I'm traveling next month and need refills on my medications before I leave.",True,,,,,2025-07-30T04:24:17.876857,2025-08-27T17:47:17.876890
76a7502f-1e35-40ad-abe0-843d7350cdd9,e25af37a-eaba-4580-bb90-1dffa295329f,790e8206-8fbb-416a-87c4-f301db372eb0,"Hi William, the side effects you're experiencing should subside in a few days. Call if they worsen.",False,,,,,2025-08-03T12:54:17.877131,2025-08-27T04:08:17.877163
6d5f1730-9b74-4e98-a84f-d98c0763afe0,eed83447-86f9-4f02-90f6-52cc9c836500,a5a87e1d-09b6-4dcd-903f-c197e55adf69,"Hi, I've been following the diet plan we discussed and lost 8 pounds so far!",False,,,,802297a9-36d0-46a7-91a0-7822eb716be5,2025-08-06T15:44:17.877394,2025-08-23T04:07:17.877416
82ed35a0-afa7-4149-a916-8d4551b86f8a,db1b7731-1f9e-4850-8f6a-0058042191a7,47673a55-980a-42bb-8ccc-4c61841641b1,"Hi William, I've reviewed your symptoms. Let's schedule a follow-up in 2 weeks to reassess.",True,,,cf1dcb84-9d99-4f04-b3a8-da179ea255da,,2025-08-13T15:25:17.877496,2025-08-01T07:57:17.877509
2013d8ee-a700-4f26-bddc-9626009640d5,7ebefb65-6beb-4a77-aa81-32017695e371,8738d36f-3be5-4b67-ad5d-8ac91012c52f,"Hello, my insurance approved the MRI. When would be the best time to schedule it?",True,,,0abe327d-e212-461b-a85b-9ea336cc9e24,,2025-08-07T19:53:17.877876,2025-08-10T05:57:17.877894
fc92e6dc-bb78-4a16-9f4b-e82d4253f69c,f08f04cc-5529-43e6-a547-09b03d40cf18,550961dd-96ca-4b1c-b51c-c8670f981217,"Hello James, your blood work shows slightly low vitamin D. I'm prescribing a supplement.",False,,,46573a57-1614-42a4-bd1a-7f091f37cd3f,,2025-08-07T17:51:17.878040,2025-07-29T10:29:17.878050
8bb848cc-1e7a-492e-a3c4-a59a786572b3,17793629-f4b8-4857-b44e-3d721bb3d277,b727f25d-ec7d-4563-813d-7f88604df409,"Hello Marian, the X-ray shows no fractures. Continue with rest and ice, and follow up if pain worsens.",False,,,,,2025-08-27T19:23:17.878174,2025-08-01T01:07:17.878190
7115d121-65e3-4a94-98fd-5df26d525bf1,3b96a730-a79d-4737-97cb-b10c6828755a,5f1c1b1c-5c83-48e8-8e0f-0153c13a7d1d,"Hello Amber, your mammogram results are normal. Schedule your next screening in one year.",True,,,,19a48e10-c67c-4ab6-bcca-67dce60ed88a,2025-08-11T06:44:17.878252,2025-08-18T23:53:17.878263
93e1dc6e-7343-4652-9161-f3f3f904382a,ee2788bb-fc0c-4239-a42e-5c803bab0111,9ea46894-427b-41fa-9a7d-4d6fd972b10e,"Good morning, I'm traveling next month and need refills on my medications before I leave.",False,,,1b747804-9fe1-4337-b51f-b245d277eb03,,2025-08-09T18:11:17.878416,2025-08-01T05:08:17.878433
8af01e26-f5e2-401a-af9f-77efd0ad8e20,d2be2c87-9d26-4224-bc53-70e4dbe80ae6,93b40031-c9c5-4d2c-9ab2-27e7eb2d1475,"Hi Leonard, I've reviewed your symptoms. Let's schedule a follow-up in 2 weeks to reassess.",False,,,,318b3abf-f9b3-428b-81ae-c35aa9fbdd90,2025-08-25T06:52:17.878626,2025-08-22T09:48:17.878635
e2eeeade-a9e7-4ed2-80b9-414bb6f2d0dc,7e4838c1-a097-4bf0-81e2-2578a4f73275,db1b7731-1f9e-4850-8f6a-0058042191a7,"Dr. Dr. Robinson, my blood pressure readings at home have been higher than usual. Latest was 145/95.",True,,,,5c5d499e-f351-43f7-a144-cc6503a0c385,2025-08-05T13:43:17.878722,2025-08-18T08:13:17.878806
e16fdda2-da64-48cd-912a-2ba64df4513b,158c2b7e-cfb5-4298-8d6e-9785f7a15cdc,3fda10a9-d0a6-47ae-a4e3-1613012b21fc,"Hi, I wanted to let you know that the physical therapy is really helping with my back pain.",True,,,0f4291c5-78ff-43c3-83d5-cf1f60d50908,,2025-08-26T02:42:17.878856,2025-08-13T00:15:17.878863
d883772b-93c0-482a-bd84-79c88500bb35,cca7561c-4cfb-4591-a74e-87d5d0472a69,974a7d10-fb7a-4f61-9f29-490a839f32cc,"Good afternoon, I'm having trouble sleeping since stopping the ambien. Any suggestions?",True,,,0fc7a69b-64cc-45fe-b692-89e0fa09bf34,0ad78251-d7bc-4e8d-9731-3be9434f4266,2025-08-12T18:21:17.879026,2025-08-04T18:16:17.879033
4449a076-6c23-4421-82ac-2de1e3be3cc9,03c1c689-22ec-4de2-b5ec-bcd75c8008bd,69f2a7b9-0833-4964-af47-21ed72770da9,"Hello, I've been having chest tightness when exercising. Should I come in for an evaluation?",True,,,,,2025-08-05T10:03:17.879104,2025-08-09T14:29:17.879113
8c104493-da79-4f96-a8d6-35e1a23f74d6,57e672bf-f689-4c78-bc9a-532f84f75c6e,a3d8c9d4-c6c4-48cc-9a1c-591c6473dd68,"Dr. Dr. Cook, I'm concerned about a new mole I noticed. Can we schedule a skin check?",True,,,,,2025-08-21T07:37:17.879218,2025-08-07T09:50:17.879225
370744df-2ad7-431e-88f8-8e95e5af8119,82991dda-bfc6-4ceb-8896-c1106e003840,c81dd011-2354-4c0a-bae7-c169a990fc22,"Hi Luis, your blood pressure is well controlled. Continue current medications and lifestyle changes.",False,,,4717ec5e-9750-41c7-829d-7c4ea9eea8ea,,2025-08-01T19:44:17.879313,2025-08-19T06:31:17.879320
5effb5a3-5cbc-44dc-a440-128e2e3e7fad,dc831cfb-881f-4aa8-8d6c-de765d6799e3,7617f4f0-656f-4df6-a342-b4fee210e10d,"Hello Michael, your lab results look good overall. Your A1C has improved to 6.8%. Keep up the great work!",True,,,,,2025-08-26T11:32:17.879435,2025-08-03T05:09:17.879443
ca880313-275a-4de3-a4e5-61a7e10a6805,2e4c2233-b968-41f9-87f8-770cf5b832e3,6f86cb06-7d4b-45df-ada3-8715aa4d4dbd,"Dr. Dr. Slater, my blood pressure readings at home have been higher than usual. Latest was 145/95.",True,,,,,2025-08-07T04:02:17.879496,2025-08-26T01:50:17.879501
23372635-0b2c-4864-a20d-94cad6965dcf,ba8eb141-c8ab-45f1-ba40-ccc9d22220cb,043ef0c7-e934-48ca-a1fa-1e4566951dd9,"Hi Melissa, I've reviewed your symptoms. Let's schedule a follow-up in 2 weeks to reassess.",True,,,98e1ff02-25fd-48d9-956b-509f50825e7f,,2025-07-30T19:34:17.879532,2025-08-03T11:12:17.879538
032dae8a-18e8-450a-8e5d-458da55d84c6,034ae3aa-1029-43c1-9fe9-675c4167892f,90e2e13b-6c91-4dc6-92f6-0e7db1cbc166,"Good morning Melanie, I'm sending over a new prescription for your blood pressure medication.",True,,,,,2025-08-05T15:17:17.879618,2025-07-31T12:47:17.879624
da9ff497-7506-4e0c-997b-e8f9fb9dc6be,8a7797a4-410c-4c73-bae6-b31033d2a108,f9f2708d-d574-459f-b2d8-e4b81f6ad3bb,"Hi, I need to reschedule my appointment next week due to a work conflict. What availability do you have?",True,,,,,2025-08-25T13:50:17.879720,2025-08-03T23:45:17.879725
924b8224-9ab8-4b49-9d41-a9a42a79a3b0,5af8a52a-ef63-4341-a595-deb8dc704259,0fe7c54c-630f-41cd-a702-05418a6da96e,"Good morning Katherine, I'm sending over a new prescription for your blood pressure medication.",False,,,2311298a-6a2b-4551-baaa-50fd405a48c8,,2025-08-11T14:40:17.879809,2025-08-06T22:19:17.879814
cc55b6a8-21b0-419e-b5db-b93173210686,9bc7b3a3-b604-4dfd-b13d-266f814f1818,6be48a95-3dda-4d0f-a894-a6250b608d22,"Dr. Dr. Grant, I'm concerned about a new mole I noticed. Can we schedule a skin check?",False,,,29722669-1657-45cb-ac61-117319599be6,,2025-08-19T15:19:17.879895,2025-08-14T22:26:17.879901
5750fab1-89a2-497f-a5e3-4435edfb32db,7f19798e-3f2e-41a8-862c-29005e56f9e7,c4fe6023-dd93-4f5f-9207-4a69c737b306,"Hello Jenna, your blood work shows slightly low vitamin D. I'm prescribing a supplement.",False,,,,,2025-08-11T16:45:17.879947,2025-08-19T22:13:17.879953
eef9fa78-b38d-47ef-bdf1-a0fe5a91b4d5,cde3d86d-dd23-4f0f-85d4-c4ac7f786e96,037aca85-dd4e-41b3-a51a-1823207f5abf,"Hello, I've been having chest tightness when exercising. Should I come in for an evaluation?",False,,,4959b19f-b2b2-435e-9afd-ea7ecfef55ae,101e767f-2322-472e-b788-31e9ba848239,2025-08-06T00:25:17.880017,2025-08-11T04:32:17.880028
670b0fe8-49ff-408c-9ac1-6cb9ca2f4bde,ed38a7bf-8e73-496a-a6e3-61fed41753f7,75788c7d-1090-4127-b1f6-10008ddfb5bb,"Good afternoon Jonathan, I've referred you to cardiology for the stress test we discussed.",True,,,,,2025-08-07T21:46:17.880057,2025-08-02T10:42:17.880063
165b7824-0d9d-4aec-b99a-a4cc77dafa03,f30fa228-5982-47e3-adac-f3fb1bbe73a3,a6fcb47d-7481-4768-97e0-8d5566bc7155,"Hello, I've been having chest tightness when exercising. Should I come in for an evaluation?",True,,,,,2025-08-21T22:15:17.880105,2025-08-04T16:18:17.880110
9df0bdf5-db25-492b-a352-ab465684a653,b677f7af-324a-4c36-a800-50f52aacbc34,5264c547-2a84-4495-ab17-34e239b9ff56,"Hello Eric, I've cleared you for surgery. The surgical coordinator will contact you about scheduling.",True,,,,,2025-08-28T12:36:17.880137,2025-08-26T10:47:17.880142
a6af6f79-a3e6-4b36-a069-cb2f8466ae1e,f451dea9-be78-4c06-adc6-97c533d32901,dc5e4a25-4cf7-4e9e-8600-58eb857c8e0c,"Hello Bruce, the X-ray shows no fractures. Continue with rest and ice, and follow up if pain worsens.",True,,,,,2025-08-17T17:16:17.880191,2025-08-03T01:18:17.880196
7a1fd6f1-f6bd-4e09-896b-1f7ff3094958,ae39f8f8-d741-45b6-98ba-59c331529df8,0a2c7a71-b434-4d75-b2d3-ca57972d1696,"Hi Hannah, the side effects you're experiencing should subside in a few days. Call if they worsen.",True,,,,9b50cf5e-b7d6-4cb4-a6a9-def0ac537b05,2025-07-28T17:25:17.880257,2025-08-15T20:49:17.880262
b7e10afd-feca-4f99-8846-fcfa00b7bfad,b40866a4-cb33-4384-833e-625982fec289,7171330a-1729-432c-8c64-b6cd14156487,"Hello Sabrina, your blood work shows slightly low vitamin D. I'm prescribing a supplement.",True,,,,,2025-08-16T12:09:17.880284,2025-08-20T01:51:17.880289
4c9ed073-ece1-40b6-a865-7db8dd265adb,d0066b48-cdec-495f-bc05-6671becb9c16,3150735e-1414-48d5-813d-75a11e51c65d,"Good morning Melissa, I'm sending over a new prescription for your blood pressure medication.",False,,,,,2025-08-18T05:52:17.880318,2025-08-06T23:13:17.880323
ad663f29-c4d3-4aeb-b791-96719933da2d,37dfa0d1-b712-4e53-836c-1f458d2d0422,4e7c84a9-3301-4d7d-904d-eb1712370ad0,"Good afternoon, I'm having trouble sleeping since stopping the ambien. Any suggestions?",True,,,bec2307b-fa5c-4543-858e-08b59ebef1ba,,2025-08-09T22:11:17.880360,2025-08-08T03:12:17.880365
ecd1615c-9fd9-4bcd-aeed-6c440c3eda72,401d7d5c-4258-408d-9cba-41045f1d6d9d,06a1dd74-c957-428c-92b7-625f6036bc04,"Dr. Dr. Taylor, my blood pressure readings at home have been higher than usual. Latest was 145/95.",True,,,add23521-46c2-421b-bae5-1b9c08242824,,2025-08-20T07:52:17.880403,2025-08-25T14:17:17.880408
bfb91524-f0ce-4735-a073-92eaaf320746,63fe9317-f107-4eb7-855e-46c7ec35c900,d5472665-1c96-45a9-88a3-7f56fa7580b4,"Hello Gavin, I've cleared you for surgery. The surgical coordinator will contact you about scheduling.",True,,,,7cde5d39-8e09-4968-b9db-fe85ae17f6ed,2025-08-13T00:25:17.880437,2025-08-07T10:10:17.880442
0e741dd6-37f3-4f2d-bd2b-69796561c6a1,5d35f93f-d99c-4e60-a81d-11ce3f514449,958bd9ee-27e9-49c9-b64b-98047572e489,"Hello, I've been tracking my glucose levels as you suggested. They're ranging from 110-140. Is this okay?",False,,,,,2025-08-16T07:46:17.880477,2025-08-02T19:07:17.880483
45eb1468-faf0-4ded-bd6f-7a07298ff12d,01e75c3a-990c-42d6-a43b-619cd9332953,fce3727f-d189-4606-8f2b-dc64781e4256,"Good afternoon, I'm having trouble sleeping since stopping the ambien. Any suggestions?",True,,,,,2025-08-21T03:11:17.880538,2025-08-19T05:20:17.880543
0c97aa41-40bd-42ee-af19-b9f76dadc4d0,2fb32cda-5e3f-4a9b-8f8c-142c67b93ab2,c442ae81-db2c-404b-aa48-eefc266274dd,"Good afternoon Jennifer, I've referred you to cardiology for the stress test we discussed.",False,,,,c6f8ed5b-2138-4545-92a4-1d6433452c5b,2025-07-31T02:19:17.880570,2025-08-22T04:45:17.880575
a01017b6-2133-4429-b5fd-2768789fa716,10622f0a-2ed5-4ba4-88bc-fca0a35261c3,dc5e4a25-4cf7-4e9e-8600-58eb857c8e0c,"Hello Bruce, the X-ray shows no fractures. Continue with rest and ice, and follow up if pain worsens.",True,,,,,2025-08-23T00:00:17.880614,2025-08-05T08:55:17.880619
cd7448a3-c7d8-441a-bd9c-e8d27b68cc31,1e9263ac-4f0a-4459-af2a-5b769605a794,6fc399b6-b165-4d0b-91ce-d4f287ae5475,"Good morning Eric, I'm sending over a new prescription for your blood pressure medication.",True,,,,,2025-08-16T06:26:17.880689,2025-08-12T22:47:17.880694
26d384a7-95a9-47d9-ab04-6371b8587791,84ad5746-6623-4303-88da-25fca5c96f88,4915b113-4c18-452e-b0a4-3b50bc1e71d7,"Hello, my insurance approved the MRI. When would be the best time to schedule it?",True,,,,dd170b4d-2e9c-47f3-9579-8060aa25afb6,2025-08-21T18:51:17.880871,2025-07-31T20:58:17.880877
a958a631-d99e-4f93-bb53-ba27f9b9abf0,e15ec155-8578-455e-b434-bccbfb95c578,6524956e-49ca-43ec-8064-91650f2a3c27,"Hello Henry, the X-ray shows no fractures. Continue with rest and ice, and follow up if pain worsens.",True,,,,84839eb0-5a3d-4a75-97fd-69e6e6956ed2,2025-08-25T09:49:17.880912,2025-08-15T13:23:17.880916
aaad57e8-bfe6-4989-bdd6-f04cbb2c2541,28b4eed0-7652-49fa-bfdb-063202c9504c,60dd380e-af75-4f5e-8c1a-ed7de5be88ad,"Hello, my insurance approved the MRI. When would be the best time to schedule it?",False,,,7d2e598d-bea5-431b-ad14-af403f59aec8,,2025-08-03T12:21:17.880942,2025-08-26T01:35:17.880947
a7dbb3b2-f722-4034-9f1b-b58b3346b6f1,86762a33-31f7-4b1c-b52e-cf4b95d9f0e3,a4f6db81-a898-4fbe-8851-6e4c1720a967,"Good morning Angela, I'm sending over a new prescription for your blood pressure medication.",True,,,,132ced54-5f5a-4ef9-9b94-57d6a85ee525,2025-08-15T03:35:17.881009,2025-08-18T09:05:17.881016
74f18237-6bd8-4c3f-bcdf-b5a9b4ad2a9c,90e2e13b-6c91-4dc6-92f6-0e7db1cbc166,410d1970-ae25-4ab1-ab2a-5b3d1bf81bfa,"Hi, I've been following the diet plan we discussed and lost 8 pounds so far!",False,,,,,2025-08-09T20:42:17.881076,2025-08-11T09:14:17.881082
47d6fec8-a4bf-4851-9a03-80f0be2252cd,f29120fa-1905-495a-939f-ab95422450de,c0811841-1683-41dd-a16d-919b9772499b,"Hello Amanda, your blood work shows slightly low vitamin D. I'm prescribing a supplement.",False,,,d400b28d-846e-4a03-99d5-c391fe2dfaf5,,2025-08-25T21:22:17.881137,2025-07-28T18:33:17.881143
4481a071-e990-4068-82ca-bdbf1be5d074,04eaa32e-b8d9-4841-ab28-509c63fbcbfc,a961219e-e134-4036-a5ac-4fca73c472f8,"Hello Cathy, the X-ray shows no fractures. Continue with rest and ice, and follow up if pain worsens.",False,,,f4a81dac-c5a6-486a-815d-b0c78f838fd6,,2025-08-06T01:46:17.881213,2025-08-22T22:25:17.881220
4cacfd7f-6063-42a2-bdc2-2acdd922248e,aa10d20f-6fb2-46a5-be6b-7caef7fe3f3c,37cd364a-71c3-4cbe-9a37-3b14a3e69cb1,"Good morning Ariana, I've updated your treatment plan based on today's visit. Check the portal for details.",True,,,12e794a8-314d-46e2-bced-3c5243b63616,,2025-08-22T02:37:17.881267,2025-07-31T21:22:17.881275
f9f8c2e7-1146-4f34-98c6-9c9332510d08,f8470457-32dd-4d68-8bc7-dd6db9204146,bbae4049-8e1e-499e-bcd3-3402e3ea72c1,"Hi Rebecca, I've reviewed your symptoms. Let's schedule a follow-up in 2 weeks to reassess.",True,,,694f0376-384d-4e3f-918d-72143638bc92,1ea06285-e516-47c2-b555-7631785b1365,2025-08-08T01:20:17.881350,2025-08-04T18:16:17.881358
eb107f68-7da9-4544-b457-3540b43d25df,1c87e990-3b4c-4794-9ede-43dfaa95dba1,44253d7e-15e6-425f-98bd-81a6b594d95c,"Hi Natalie, congratulations on your weight loss progress! Let's discuss adjusting your diabetes medication.",False,,,25fb969d-554d-4548-99b3-0c3691462099,e82dc60c-79c4-49a1-abbf-0836779de05f,2025-08-05T09:37:17.881483,2025-08-22T17:25:17.881489
3bb347e1-c05e-4908-82fc-3831c60bc716,bcc86278-839f-4248-9dc8-99b6609ef67c,7df16a1e-359e-4209-ba38-90284b037f96,"Good morning Gabriel, the CT scan was normal. I'm glad we could rule out any serious issues.",True,,,,,2025-08-19T00:26:17.881560,2025-07-31T23:07:17.881566
b75dcbec-cce8-4fd6-9a93-927b11bb1039,619bf4c5-1c11-4b32-b460-be2e5961d037,9b173fbe-0b96-4861-8ec3-abda1b10b995,"Hello Sara, your lab results look good overall. Your A1C has improved to 6.8%. Keep up the great work!",False,,,,,2025-07-30T12:31:17.881594,2025-08-16T01:34:17.881598
7c6ae68f-22b6-4e97-b791-0f7082fa0dd5,8967ddf2-1725-4f4c-898d-215c5ec8972b,84ec089e-bd58-431e-a1bc-42388ff37825,"Good morning, I'm traveling next month and need refills on my medications before I leave.",True,,,adcddd30-d28b-4472-96be-62102076588d,44aab8f6-21bb-4dd6-8a39-4090fdb6a4a8,2025-08-24T12:18:17.881631,2025-08-24T22:09:17.881635
1e208760-c0d1-4495-9a49-a6485f460183,b40866a4-cb33-4384-833e-625982fec289,6743bc3f-a4e5-48c7-b80c-743d46bc964a,"Hi Eric, the side effects you're experiencing should subside in a few days. Call if they worsen.",True,,,838bdd08-ada3-4e4f-bedd-4136149f7fec,b4135a80-b27e-4360-9201-0249f4b32afa,2025-08-02T07:00:17.881676,2025-08-12T04:46:17.881682
ad2dac30-980b-4be9-8f8b-2650a7087dde,8ff1f532-7a2f-4ade-a5e2-b4e1daf2a387,e0342001-b6b2-461f-9a51-a07baa238155,"Hello Randall, your lab results look good overall. Your A1C has improved to 6.8%. Keep up the great work!",False,,,14d5fc6c-56f0-4d57-ba67-4fa7376888ca,,2025-08-06T22:49:17.881728,2025-08-27T17:29:17.881733
953ca0cd-2266-4295-bb63-b8b547fad023,42e91107-d90e-4635-bd0b-6551756493a4,102dfe50-d81b-4a50-abe4-607fea5dc7cb,"Good afternoon, I'm having trouble sleeping since stopping the ambien. Any suggestions?",True,,,,,2025-08-15T02:33:17.881814,2025-08-09T21:54:17.881819
954450b0-8e81-4341-8ce7-53b35e2c2107,ff0971f7-005a-4c63-85c2-f7f1eefad977,c5dd5ebb-decb-4e59-9052-a3666b4863d9,"Hello, I've been having chest tightness when exercising. Should I come in for an evaluation?",True,,,,,2025-08-02T16:32:17.881847,2025-08-10T02:29:17.881851
26c39198-fd9a-4946-87e0-73cdf00215bc,63446fb2-fa2d-48ec-b119-c126074caed5,1cbac227-f547-44f2-9a12-f029dd8813d5,"Hello Isaac, your blood work shows slightly low vitamin D. I'm prescribing a supplement.",False,,,,,2025-08-06T16:34:17.881988,2025-08-11T05:48:17.881992
743b511d-a9ec-480f-9aa1-617364298c84,0d431174-1716-4c4f-8a1b-f00bc5ec42c3,909a08ea-6236-486b-956f-b16664103f3e,"Good afternoon, I wanted to follow up on our discussion about my sleep issues. The CPAP isn't helping much.",False,,,58a9dfd4-e09f-4c5d-8459-8f5880c74091,,2025-08-04T20:47:17.882027,2025-08-10T13:37:17.882032
7dd02c16-5990-406e-9a0f-d37b466c27b6,385b0068-a9f8-46c3-b51d-1f0f55eacdd4,2ca25bb3-8b72-4f58-9a3f-5d9a06a33739,"Hi Joseph, the side effects you're experiencing should subside in a few days. Call if they worsen.",False,,,,8baffd73-e2d2-472f-a4d4-303bf8a460d7,2025-07-31T13:04:17.882084,2025-08-05T17:24:17.882089
40234907-6653-4297-9fc6-781a9783aa30,2b5d3dbe-89fd-47a8-bcee-1895dcf2c536,044f2016-7aa0-43c3-989b-e6ff44e2642a,"Good morning William, the CT scan was normal. I'm glad we could rule out any serious issues.",False,,,,,2025-08-19T02:32:17.882147,2025-08-02T17:36:17.882151
4591e384-9b41-48bf-842d-170d26858128,d23cb861-ade5-4f3d-9206-7719b60a482d,5f1c1b1c-5c83-48e8-8e0f-0153c13a7d1d,"Hello Amber, your mammogram results are normal. Schedule your next screening in one year.",True,,,,,2025-08-13T07:08:17.882177,2025-08-16T16:27:17.882181
7d087952-34a4-4356-bd9b-4a9a16022410,640d454a-6996-40fa-8237-ba0da05c7bfe,6d50f709-9fca-426b-a736-789dad9083f7,"Good morning, I'm traveling next month and need refills on my medications before I leave.",True,,,,59be8b0d-095f-49aa-9634-9046e33425ad,2025-08-10T12:20:17.882236,2025-08-21T23:07:17.882240
743c3071-abb5-436a-9474-e63a4cb896b0,f7a0fc14-9251-4cbb-96dc-d33e02290fdd,dbcd1df3-1785-4168-8420-6aa0109e09ce,"Hello Philip, your lab results look good overall. Your A1C has improved to 6.8%. Keep up the great work!",False,,,bd9e1b06-dde7-4c75-85bb-68ca8630051b,,2025-08-24T03:52:17.882324,2025-08-04T08:24:17.882329
c2fad87b-c6df-4059-9301-9c7fe77ab024,3a1347b2-b580-40b5-9e7b-432e13bee47e,303cd5a9-54e3-413e-a4db-c8e093545de8,"Hello, I'm having some side effects from the new medication - mild nausea and dizziness. Is this normal?",True,,,,,2025-08-19T01:06:17.882370,2025-08-25T06:40:17.882374
f0092867-fb34-4fa8-b10a-3b6f18bc795e,c2970e9c-6744-4a6e-8944-aa290a8dbb77,03ef2223-ec05-4905-bfb3-01c367e3dedc,"Good afternoon Jessica, I've referred you to cardiology for the stress test we discussed.",True,,,8a666aa0-e880-4676-8f5c-3bdd0715f418,e4a08aad-68f5-45dc-879e-1465ab778a1b,2025-08-17T09:41:17.882459,2025-08-16T07:40:17.882465
7f172f5a-4ce6-46a7-9bf2-3cca4553c888,fbf80c4a-ff9e-45a5-b3b4-7108878577b2,905c5ff9-27dd-4021-9da9-382afd678ac0,"Dr. Dr. Wilkins, my blood pressure readings at home have been higher than usual. Latest was 145/95.",True,,,235a375a-aa2f-4aff-bfa0-741a8918c65b,,2025-08-02T00:15:17.882530,2025-08-18T19:53:17.882534
