message_id,sender_id,receiver_id,message,is_read,previous_message_id,next_message_id,appointment_id,thread_id,created_at,updated_at
410722ac-8503-425d-ac14-60e474276540,28289e3b-c4e4-4522-ade0-bd5592668f44,6743bc3f-a4e5-48c7-b80c-743d46bc964a,"Good morning Eric, I'm sending over a new prescription for your blood pressure medication.",False,,,,f4e560f3-caf7-4877-8cf9-40670a555cc8,2025-08-28T12:29:17.913821,2025-08-11T09:01:17.913832
cbda7fe6-9729-4864-93ba-208ca1f94a07,ee9a385a-0183-4d51-806e-975bcdd72825,81e28c37-0425-4047-8086-b28f3e022fa6,"Hello Bianca, your blood work shows slightly low vitamin D. I'm prescribing a supplement.",False,,,,95478d56-ef86-4e9b-bf82-028b4ea63908,2025-08-25T09:39:17.914417,2025-08-18T04:49:17.914442
8c726335-9ea0-4e53-a757-55d10017fc6e,8d90a3fb-b1cc-4e7e-b497-0867e1ac88f8,dd92927c-28dc-423b-ad4a-179da83ee421,"Hello Eleanor, your mammogram results are normal. Schedule your next screening in one year.",False,,,51a1ff14-bd9b-4272-8047-2ad931b674ad,,2025-08-08T05:09:17.914616,2025-08-12T19:33:17.914629
17d25512-222c-48ba-9a6d-cdad99a949ac,df9255af-8b11-43a1-a278-89d042839149,ba8199e0-9078-4bcb-8ec0-f57e562cf843,"Hi Emily, your blood pressure is well controlled. Continue current medications and lifestyle changes.",True,,,eb34d0bf-0d05-4479-9590-e3961c88a143,,2025-08-25T10:57:17.914854,2025-08-14T22:29:17.914867
85c9b676-4c43-4189-a74f-7f9aac51b025,a6b307ae-01ad-4b93-b5fc-2e003e016f9a,2634628e-5405-4ed2-97c5-ab762a290915,"Hi, I uploaded my lab results from Quest. When you have a chance, could you review them?",False,,,,,2025-08-02T20:28:17.915071,2025-08-25T03:59:17.915087
d5158fd6-6195-4dd1-b3db-cbc07ddb7f11,40e3cf7a-0e04-4d9b-9c74-8b15b279b51d,a0170b29-5c52-4665-a1c4-a675bd18bb62,"Hi Kyle, your blood pressure is well controlled. Continue current medications and lifestyle changes.",False,,,eaef3c2a-c959-4943-93e8-a7f5c1eb7179,520822fc-4280-4bcd-9ec3-9c918fb3045b,2025-08-19T04:22:17.915312,2025-08-19T22:14:17.915328
bc03a9bf-86ba-46e6-903e-567030407e41,e5da8d42-edaa-4479-bbde-e83123b9fbf4,7f9d6d81-331c-430d-9df7-590dfcf46fe0,"Hello Daniel, the X-ray shows no fractures. Continue with rest and ice, and follow up if pain worsens.",True,,,d3609ec6-cb18-473e-a00c-74ae16d44460,,2025-07-31T05:04:17.915550,2025-08-08T03:30:17.915566
ed05f861-e3cb-4e57-a508-f320a0b83bd4,5816dac9-8776-4d83-9d0f-d4a7cd47a610,dd79a12f-079f-4c13-9b9d-4bc4f738e4e2,"Hello Travis, your blood work shows slightly low vitamin D. I'm prescribing a supplement.",True,,,,01d52cca-d5b4-4dbc-855a-74e039bedace,2025-08-13T18:47:17.915751,2025-08-14T11:57:17.915767
c14b546e-0f39-46fa-b9a8-fc48b8547bde,1062db49-71dc-4af2-8ea7-805b93f16d16,c2a758e3-3df0-4de7-9bcd-6019943bf6b5,"Hello, I've been having chest tightness when exercising. Should I come in for an evaluation?",True,,,,621b18df-bff1-45b9-81f4-d2452c5c0331,2025-08-16T18:11:17.915908,2025-08-11T10:58:17.915930
54e535ce-b367-4207-996d-971909652e88,c8c76c20-31b6-4c9d-abd1-e56f01e10b24,07fa1ffe-6159-498b-94e9-b5476e8003e1,"Hi Tina, your blood pressure is well controlled. Continue current medications and lifestyle changes.",False,,,26c47ec6-2df8-49b7-98fb-84eb811c7f23,,2025-08-27T20:37:17.916113,2025-08-27T12:13:17.916132
e8169aa0-2052-4616-ae17-43ec50061e2c,63a89b6e-99d1-4ab9-a685-080f660ba1aa,9aad1b90-61de-414d-903a-e8a5d386f272,"Hello, I'm having some side effects from the new medication - mild nausea and dizziness. Is this normal?",True,,,,,2025-08-11T07:47:17.916411,2025-07-30T02:01:17.916429
b93e14dc-c333-465b-b64a-ee2ceb4cc876,70112b91-2c0f-439a-8402-fb55d145260d,e9d506d3-de39-46f2-924a-906982d25e79,"Dr. Dr. Sanchez, my blood pressure readings at home have been higher than usual. Latest was 145/95.",True,,,,,2025-08-19T18:28:17.916478,2025-08-09T20:14:17.916488
fe7a9b45-8b97-45b0-ba29-159999b14aca,6659ebb3-9d7a-411c-a69e-4665f85711e2,eac2dabf-4fcb-4b10-b306-44991ba46a9b,"Good afternoon Paul, I've referred you to cardiology for the stress test we discussed.",True,,,,b5e555a5-4e09-47a8-977a-0e931cd17e05,2025-08-04T06:48:17.916530,2025-08-19T18:01:17.916540
7c212c0a-5778-4e3b-b904-390c9e8b3aa3,6328d01a-b9a9-4912-bda5-dd0d44240329,cbd67539-e147-4aa4-b250-daf05406f420,"Hi Alicia, the side effects you're experiencing should subside in a few days. Call if they worsen.",True,,,,fdc09efe-5035-49ae-8130-080d476e8f21,2025-08-12T19:47:17.916601,2025-08-23T02:20:17.916611
7e261d6f-e7d4-4c5b-aaf0-b0c69662cbb3,ea3dabcb-9c0b-4b2c-bf58-ca9d4d21e2eb,66cfb215-516f-4851-9717-bce2580175c2,"Hello James, your mammogram results are normal. Schedule your next screening in one year.",True,,,b3218470-5762-41fa-83c3-f23fa612309b,,2025-08-02T18:19:17.916749,2025-08-02T03:35:17.916766
b834dc57-555c-4188-82c3-2c6a69c753e2,24dd3d73-95df-426b-98f5-6e3c5a02339b,cbd67539-e147-4aa4-b250-daf05406f420,"Hi Alicia, the side effects you're experiencing should subside in a few days. Call if they worsen.",True,,,,af21d76b-34a9-4c39-8ebc-1171e99ff620,2025-08-25T11:58:17.916831,2025-08-11T10:40:17.916841
0cf3d54e-acb8-4a77-966f-81575fe72150,fb6f075d-80c9-45de-9985-11f85bc84530,81f55377-d93d-4d57-bddf-114ac9d40f69,"Hi Anna, your blood pressure is well controlled. Continue current medications and lifestyle changes.",False,,,,a669354f-d9b5-4bbd-b622-0da1f601f955,2025-07-28T23:00:17.916962,2025-08-08T06:57:17.916972
0d3b1080-2609-4263-a756-cc7763717991,f30fa228-5982-47e3-adac-f3fb1bbe73a3,7ec729d2-0b67-4e16-8bea-a3327d11caf6,"Hello, I've been tracking my glucose levels as you suggested. They're ranging from 110-140. Is this okay?",True,,,82ebb37f-cd5f-4481-8e3f-b46d23a37f73,,2025-08-10T17:52:17.917025,2025-08-12T22:56:17.917035
57a8dbb9-5f1f-4c6a-a8a9-55d779604fd2,dd92927c-28dc-423b-ad4a-179da83ee421,1d1b373a-d6bd-4b93-8130-068dda8e8821,"Good afternoon, I wanted to follow up on our discussion about my sleep issues. The CPAP isn't helping much.",False,,,,01d05342-c9c2-4a25-8ace-700ee606854e,2025-08-11T10:22:17.917130,2025-08-06T03:07:17.917140
a807bc17-4944-4780-be43-ce9a1b38cce0,bc5485c7-92cb-4929-a1b9-ecc55f394032,f7e6f681-0f03-4b74-bc09-b0a6d5b365d5,"Good afternoon, I'm having trouble sleeping since stopping the ambien. Any suggestions?",False,,,,,2025-08-27T12:54:17.917226,2025-07-31T19:47:17.917236
d68448c6-11f9-47f5-815a-823acb1f1d91,94ed2e0c-ec58-4b56-84df-7305d9a86fb2,63446fb2-fa2d-48ec-b119-c126074caed5,"Hi Dr. Dr. Macias, my pharmacy says they need a new prescription for my Lisinopril. Can you send it over?",False,,,,415235ef-40f8-4546-bec5-df61599abcbc,2025-08-27T20:52:17.917294,2025-08-06T09:42:17.917303
9083d85f-3017-4645-a19c-d1e93359b3cb,0c992032-4142-438b-8dbc-9ff0b28885b9,1e9e2a9b-7333-4314-be49-0cb874801c8c,"Hello Leigh, the X-ray shows no fractures. Continue with rest and ice, and follow up if pain worsens.",True,,,4e1176dd-aaa1-4890-856b-32aa46342c6c,,2025-08-15T01:20:17.917333,2025-08-07T00:36:17.917338
bbe41d2e-2ab7-4898-a4c3-df8b27d03478,2e4d0a18-4c0a-4e11-b577-2583e7f594d6,7f9d6d81-331c-430d-9df7-590dfcf46fe0,"Hello Daniel, your mammogram results are normal. Schedule your next screening in one year.",True,,,6c18c0d5-24a5-4469-ac55-3dc3798f54f9,,2025-08-24T16:23:17.917422,2025-08-05T02:41:17.917426
d4089f43-0d0a-4402-b574-101d32f4f4e5,60bd70b7-1595-4b9b-a3a6-c7085435b2be,57d12445-9398-416e-91a7-70799eac31f6,"Hello Anthony, I've cleared you for surgery. The surgical coordinator will contact you about scheduling.",False,,,,,2025-07-29T16:20:17.918193,2025-08-06T06:20:17.918279
5c6882f1-664d-46a9-be77-7650bea72d06,5b652882-bcd4-46c8-8998-1461d9668daf,5191ecb3-e49c-4177-b4db-9841215526e7,"Dr. Dr. Burrows, I'm concerned about a new mole I noticed. Can we schedule a skin check?",True,,,f8e9e907-8adb-40bd-9341-12dcd79c73df,,2025-08-07T15:42:17.918714,2025-08-12T03:38:17.918734
eadef3b1-876e-469a-8e5c-5548247d6395,6333cc01-1dd4-4e4b-9bd2-32eb375bb571,8a29d59b-5680-46e3-8b0d-a2b0e49cba39,"Hi Shawn, congratulations on your weight loss progress! Let's discuss adjusting your diabetes medication.",False,,,,,2025-08-16T23:08:17.918840,2025-08-25T00:06:17.918854
53b05cbf-9521-405f-a736-94e440fc4dd7,81ec1cd0-12d0-4463-ac56-b2538cdf2d2e,3d3f96b0-c315-43b6-9cd9-31cca7f05d39,"Hello Matthew, the X-ray shows no fractures. Continue with rest and ice, and follow up if pain worsens.",True,,,,f4a7bfbc-c601-4f77-9c83-a6373c8b2262,2025-08-26T22:08:17.919562,2025-08-01T19:30:17.919608
371a9c08-e106-4d0c-b673-f28ac83dd990,7a992dcc-1bb7-46e5-9364-3d54b877d719,432669bb-3035-455b-866a-d69ca9fa4ed3,"Good morning Colleen, the CT scan was normal. I'm glad we could rule out any serious issues.",False,,,8610a16c-1317-4ca6-93fd-bec54e807c68,,2025-08-05T14:17:17.920916,2025-08-22T08:10:17.921102
8811113d-af1b-47af-be58-b53df0ad9b3c,66e16c05-7ca8-46c4-8e23-67e1d3aca988,fc2c509a-b958-4a8e-838f-98a6e8ad7941,"Hi Christine, your cholesterol panel shows improvement. Continue the current statin dose.",False,,,,,2025-08-18T17:21:17.921741,2025-08-24T10:58:17.921767
555c424c-d8e0-49df-a006-cf3a7fcdf612,3e9e5f48-67c0-4251-939c-42a64081de9e,165b9fde-7cec-4db4-88a6-7e95b6cc4ca9,"Good morning Dr. Dr. Delgado, I've been experiencing increased fatigue lately. Should I be concerned?",False,,,4489356e-e9c1-40b9-96b8-282d804ec3b6,,2025-08-22T16:27:17.922057,2025-08-15T21:56:17.922080
15242036-558f-4617-bfff-4bc7256be50e,deeef2b9-cdac-44d4-b343-ab141c155b5f,46b35e25-275a-4917-bb54-451443bd353b,"Good morning Andrew, I'm sending over a new prescription for your blood pressure medication.",False,,,160fb09d-3812-478a-a907-c82d61b4adfa,,2025-08-14T08:21:17.923731,2025-08-03T05:25:17.923888
d52d6628-6cf0-4378-a36b-552af2cba86a,97c43a9d-ce88-4639-a69a-77b86a9114ba,94425360-1913-4faa-b43b-c97442d754ac,"Good morning, I'm traveling next month and need refills on my medications before I leave.",False,,,573d6ccd-34ad-4209-b3a0-bdeabe49475f,a7abe9cc-24aa-41be-be07-12ac409f77c3,2025-08-16T17:04:17.924401,2025-08-06T16:24:17.924419
db056674-58de-485f-a9ac-2b48a5e91ec6,2660919b-f76b-4359-9bb7-cb89bb70ef2e,88e766af-3b58-4fe6-9104-de5234ccb6b9,"Hi Patrick, I've reviewed your symptoms. Let's schedule a follow-up in 2 weeks to reassess.",True,,,,,2025-08-04T14:40:17.924547,2025-08-15T20:12:17.924562
e7e71916-ba5f-41f8-b2b4-923cc6a39b48,5af9db36-7897-4459-b9a5-370b416adc3a,159beda0-7dcc-4918-af42-5a5110e6abc3,"Hello Bethan, I've cleared you for surgery. The surgical coordinator will contact you about scheduling.",True,,,9f0188d0-67ff-4a4b-9283-5674e8eb0890,,2025-08-25T07:38:17.924662,2025-08-14T01:19:17.924673
3ff61c82-25ea-45d4-8e09-2dfe0be9e8a6,398eb9de-be3e-41fb-9861-bf6539119acd,ac2640f7-6612-4db5-b3a7-59765525d57b,"Hello Jay, I've cleared you for surgery. The surgical coordinator will contact you about scheduling.",True,,,a09b580c-33a2-406c-9d97-b6acd137d377,62a64bcd-b7cb-498b-b2b5-3d0c8c37a038,2025-08-06T04:32:17.924809,2025-08-10T07:59:17.924822
03a20383-1ec6-404d-8ef0-bc4135216d69,3ed3ab6a-6101-4e7a-bbb7-955f74999906,d99972cf-d5bc-4630-bfa7-fbd9395605ca,"Hi, I uploaded my lab results from Quest. When you have a chance, could you review them?",False,,,6950e4e9-4c77-46c4-aecb-119097fa618a,,2025-08-07T18:01:17.924967,2025-07-30T07:16:17.924981
4928eb78-34db-491c-84eb-42eeeade4391,6e00a18d-8072-4a64-abd7-5ca7fc7c18b7,58945d9c-6052-4e3d-95f8-82ccdc991f31,"Good afternoon, I wanted to follow up on our discussion about my sleep issues. The CPAP isn't helping much.",True,,,,36f34880-dce2-4a5b-9301-c1e240a865dd,2025-08-22T20:10:17.925162,2025-07-30T09:44:17.925172
45ba1fb4-481c-4fb0-9d8d-4ffc8c340144,77317aae-3e0f-4928-b6a6-187d264f2e78,8bb76840-91f2-4df3-b65e-0dbed4d22a41,"Good morning, I'm traveling next month and need refills on my medications before I leave.",True,,,,,2025-08-20T06:26:17.925407,2025-08-18T16:37:17.925420
0fa78da0-0ba3-4f9e-a2e7-32c729cdf175,161084f5-cec8-4608-90bb-2dcd54b7619d,1c602e75-d7db-4356-a083-c9d64e28d126,"Hi Danielle, I've reviewed your symptoms. Let's schedule a follow-up in 2 weeks to reassess.",True,,,,,2025-08-01T05:54:17.925494,2025-07-30T13:44:17.925507
5edb0246-b55b-40a2-8a92-74b79d82b115,af301eb0-0a60-4a7f-a42d-08ac5d6fe1d2,a881affb-7f96-491f-8c33-534f39201408,"Good morning Arthur, I'm sending over a new prescription for your blood pressure medication.",True,,,2f8adbd7-450d-4709-ad6a-5e91bf0df716,,2025-08-08T19:34:17.925555,2025-08-17T09:23:17.925571
01babb02-65c9-499b-bacd-c878629c1012,742afaa5-2468-4e69-a183-f78c27066f61,7ff85e86-8c91-47ee-b312-97423f406f4b,"Hi Natalie, the side effects you're experiencing should subside in a few days. Call if they worsen.",True,,,2e67339f-17fe-424b-bd25-cc735f68d032,73a4c3b0-a72b-4939-93aa-a9832e69b9a7,2025-08-24T19:47:17.925787,2025-08-05T20:03:17.925819
386ed64b-49c1-451d-9969-a08f0d4fb599,5b7130d7-7723-444a-80d6-17cbd6ab46e2,094a395c-ee38-414b-bc5a-4362a3639c6b,"Hello, I've been tracking my glucose levels as you suggested. They're ranging from 110-140. Is this okay?",False,,,,,2025-08-07T21:57:17.926028,2025-08-20T09:52:17.926066
81b1e879-8a4e-4c87-9fe9-d83e5288280f,eabdc465-af58-469c-b14b-3ec4a8e4200a,398eb9de-be3e-41fb-9861-bf6539119acd,"Hi, I need to reschedule my appointment next week due to a work conflict. What availability do you have?",True,,,dae4d6aa-728b-4d12-81e7-c10176a91d8e,07fa5557-8c34-4635-bcd2-e9db099d0ccb,2025-08-20T04:34:17.927367,2025-08-21T06:17:17.940828
f2189825-706a-46e2-967e-2b78ccdaf6f8,e60ed06a-9118-479d-b2cd-b32a206b40e9,3fba0a66-d413-4e00-b092-f3dd707d147f,"Hi, I uploaded my lab results from Quest. When you have a chance, could you review them?",False,,,,,2025-08-03T12:17:17.943177,2025-08-13T12:09:17.943306
3ae1b741-0761-4871-8448-b43de32c14eb,95cb9d66-17d2-4806-a1d3-2c8dc2380603,b511c37c-c0f6-456a-8c5e-1cc2ab3ff6c5,"Dr. Dr. Mitchell, my blood pressure readings at home have been higher than usual. Latest was 145/95.",False,,,564001b5-529e-481a-a331-d0b5744209da,91e819d6-6b70-4781-abcd-c7bf1bd58f2a,2025-08-04T23:14:17.944229,2025-08-05T23:33:17.944255
3602626e-c3ed-4787-b992-2a33491a35a2,491f929c-2f0a-4c7b-bf64-defbc7c85ed2,f3bdc39d-c5cf-4aef-9f56-c953434045b5,"Dr. Dr. Wallace, my blood pressure readings at home have been higher than usual. Latest was 145/95.",False,,,bc3f28b6-32d0-46be-97e2-e6330f867960,,2025-08-28T06:42:17.944780,2025-08-22T17:04:17.944796
3be0affb-7341-4813-a31c-2ac9930b4e55,5e26dae3-c03e-4add-ab18-38fe2a867b7f,037aca85-dd4e-41b3-a51a-1823207f5abf,"Good afternoon, I wanted to follow up on our discussion about my sleep issues. The CPAP isn't helping much.",True,,,,,2025-08-24T09:30:17.945025,2025-07-31T02:51:17.945041
0d5eaf1e-003f-45a1-9b07-e65f00c3bc24,6a45f83f-4bb6-4569-b72a-08016e6cbf55,c78410a6-28fc-4e91-b868-ab07adb2a22d,"Hi, I wanted to let you know that the physical therapy is really helping with my back pain.",True,,,,,2025-08-14T14:59:17.945214,2025-08-08T07:30:17.945227
d240c267-5df2-4c09-81f5-7cfde51d100c,0f3bbfa3-ba93-4e41-bf88-12c77b9c5885,5af15c5a-1e08-485a-a21a-dbc92b22af08,"Good afternoon Holly, I've referred you to cardiology for the stress test we discussed.",True,,,,,2025-08-16T07:35:17.945331,2025-08-01T22:58:17.945343
bfd8b427-f236-4dfd-9699-a0daa2195cb5,ce5ef971-d0d7-45b4-9ce6-a1d7fb1abfe9,2e119116-b261-4042-b686-ed3c6f114952,"Hi Ashley, your cholesterol panel shows improvement. Continue the current statin dose.",True,,,,79ee2003-4951-4e67-940c-ddefafd752c7,2025-08-12T08:07:17.945442,2025-08-03T16:38:17.945465
ae0cb96b-4b84-4f70-89b0-2333a8ec89b4,a367ba5f-dbb3-46ba-9382-c6614fe6a846,3a0693cf-4bf6-4eda-bb93-ec74fbce8eea,"Dr. Dr. Rosales, I'm concerned about a new mole I noticed. Can we schedule a skin check?",True,,,0df9ee95-ff1e-47f8-a025-360e5db79988,,2025-08-19T02:42:17.945574,2025-08-19T01:07:17.945588
2cb1e72d-ff05-4f1d-8d2b-31f7b1d98cc1,b833f89b-8ed2-415d-af56-58413d61c43f,96588611-2650-40bb-adb9-73ca7c187bc5,"Hello, I've been tracking my glucose levels as you suggested. They're ranging from 110-140. Is this okay?",False,,,,,2025-07-29T16:00:17.946864,2025-08-17T07:37:17.946934
d257c6ca-2c52-401b-82cc-1099d1d13b30,93b40031-c9c5-4d2c-9ab2-27e7eb2d1475,144e9012-2564-46a7-a3ce-28eaeaa021bf,"Hi, I wanted to let you know that the physical therapy is really helping with my back pain.",True,,,4ff33d3d-7830-42df-ae87-5d0cd368a3e3,,2025-08-03T07:21:17.994220,2025-08-11T13:37:17.994350
dbc8b032-63dd-4cda-b33e-2302c7835180,b7e6e3db-8c44-4e38-9ed2-4213812e2e76,1062db49-71dc-4af2-8ea7-805b93f16d16,"Hi Christopher, your blood pressure is well controlled. Continue current medications and lifestyle changes.",False,,,,5facc28a-3af7-42c9-9df6-a6bdb8d05e02,2025-08-27T08:58:17.995461,2025-07-28T16:39:17.995495
3eca1637-264e-49fa-8a81-76ad5410fef7,112025c5-978a-4dc1-bd77-ce7fa5b320db,0690fb05-60d8-47db-bef0-03092b3ab2b0,"Hi Gemma, your blood pressure is well controlled. Continue current medications and lifestyle changes.",False,,,3f769cad-d120-4b00-99ab-eee8d29f8272,,2025-08-20T07:44:17.995606,2025-08-08T05:45:17.995704
0d99a9e7-2b53-44ef-9b89-89a0a3424a53,5dff21ba-ae7f-489d-8d3a-d03525c69468,b8418f2d-aacf-4458-a20b-b295a78d1f7e,"Good afternoon, I wanted to follow up on our discussion about my sleep issues. The CPAP isn't helping much.",False,,,,5f49a142-8964-4282-a5ac-2e5fba9bed5f,2025-08-17T21:03:17.996341,2025-08-06T10:07:17.996373
741bc0cd-1c68-4cdb-bf4b-f1ae63642a9d,46b35e25-275a-4917-bb54-451443bd353b,1e1005bb-b994-49d3-b8dc-61938bba50ae,"Dr. Dr. Brown, my blood pressure readings at home have been higher than usual. Latest was 145/95.",True,,,,,2025-08-21T23:44:17.996803,2025-08-01T13:37:17.996825
dda7e344-b001-49f0-9de7-f004a1ff6f7c,2660919b-f76b-4359-9bb7-cb89bb70ef2e,c81dd011-2354-4c0a-bae7-c169a990fc22,"Hello Luis, your lab results look good overall. Your A1C has improved to 6.8%. Keep up the great work!",True,,,72cfc1a8-0fed-46ab-bc17-e6eab8e129b0,,2025-08-02T21:43:18.063298,2025-08-19T06:16:18.063481
802918c0-e4a8-4c6a-98c6-fe79888e1240,37cd364a-71c3-4cbe-9a37-3b14a3e69cb1,f3856b34-74ba-4c53-b8a6-5601dc997c72,"Good morning, I'm traveling next month and need refills on my medications before I leave.",True,,,,c244b937-8296-467f-a97e-c8f8333f3f3b,2025-08-07T11:16:18.064213,2025-08-28T03:02:18.064248
c789028a-63ae-451a-8cfc-0e708f7fb16e,c69d5eca-5018-4152-9644-cf9e4d794808,410d1970-ae25-4ab1-ab2a-5b3d1bf81bfa,"Hi, I've been following the diet plan we discussed and lost 8 pounds so far!",True,,,,,2025-07-29T11:21:18.065325,2025-08-03T14:09:18.065359
05c28b4a-c154-415d-810c-bc5b1c00c0de,7406c489-a3c8-4ca9-b59e-8a9854c74b53,42266836-a2aa-4f8f-ae30-56c03bb0d5ab,"Hello Michael, your mammogram results are normal. Schedule your next screening in one year.",True,,,,,2025-08-24T14:32:18.065877,2025-08-25T08:01:18.065914
b8feb4b5-4e84-400c-b73a-d1b95a4b1087,b6efc7f1-f420-402d-9d4c-bc94034e3edf,0023c6ef-dbc3-4c11-b4ee-41c94dfd0053,"Hi Jennifer, congratulations on your weight loss progress! Let's discuss adjusting your diabetes medication.",False,,,,,2025-08-21T06:49:18.066285,2025-08-16T23:57:18.066306
49045449-da56-4261-a728-3ce60d39c168,5a5a4298-44e4-4f9f-a70f-1f98377038e3,38a3ddea-e2eb-4e71-a6e9-cb990647feeb,"Good afternoon, I'm having trouble sleeping since stopping the ambien. Any suggestions?",True,,,2ea88b3f-9718-4f62-b594-b512356751e4,,2025-08-03T08:58:18.067103,2025-08-02T09:19:18.067143
f28c05b3-e1f2-4216-ba76-c016d55d8b00,6dbfa39e-1808-45d9-a8e3-bc4db74cdce0,498ff2cb-76b6-4017-aa38-313b08772a5b,"Good afternoon Rachel, the specialist confirmed our diagnosis. We'll start the new treatment next week.",True,,,3c4d8165-53be-4454-a7ff-e036014fff93,,2025-08-01T10:35:18.067682,2025-08-06T16:08:18.070369
f7fe53a3-f03e-4e8c-86a9-b5b1011859d7,f1dce5db-3550-4171-b38d-3e8c8678bdc3,7f9d6d81-331c-430d-9df7-590dfcf46fe0,"Hi Daniel, the side effects you're experiencing should subside in a few days. Call if they worsen.",False,,,,0fdfc223-6011-446b-a4db-aa080ec0edd8,2025-08-08T08:20:18.072851,2025-08-26T02:18:18.072966
9ee9b694-a316-4563-b9e9-a8e345be8553,9b5bd604-ac93-4687-ad47-d68457fa5c07,fd925a37-fa43-4851-a752-f13c0d25f9a0,"Hi Dr. Dr. Brown, my pharmacy says they need a new prescription for my Lisinopril. Can you send it over?",False,,,e1e10e18-b8b5-4561-a2a9-a1fa6979512d,,2025-07-29T16:38:18.073920,2025-08-16T05:00:18.074177
83ade89c-af75-46cb-bb27-539df1115ea0,2e344628-fff2-4588-8ec5-a6586dd77fdd,4a68c037-0e95-4cb7-9625-df3aa09bccc0,"Hi Jonathan, I've reviewed your symptoms. Let's schedule a follow-up in 2 weeks to reassess.",False,,,462aa01b-3d2e-4b93-b6d2-6fcc3cbe55b4,,2025-08-24T15:09:18.075064,2025-08-16T21:12:18.075088
d866f7de-feae-43ab-9dc1-34322e1f069d,dc283bb9-784b-44bf-b2ef-43f08f54f787,26a31655-3d8c-4325-913a-3a4b7362855e,"Good morning Mohammad, I've updated your treatment plan based on today's visit. Check the portal for details.",True,,,,7437c217-a78c-4827-b4e5-3a146ca7fdf3,2025-08-09T15:25:18.076346,2025-08-20T10:26:18.076379
b9a06b5c-3612-4cb7-add6-f612f5c38429,68c1e2fe-ee45-4fa9-9804-2b69ffa2e7bc,9d2bd006-1939-4ecd-b197-f588026a7f02,"Hi Dr. Dr. Martin, my pharmacy says they need a new prescription for my Lisinopril. Can you send it over?",True,,,,,2025-08-16T01:46:18.077364,2025-08-28T01:39:18.077391
aaad3f0a-10ef-48f8-9fa5-7b6940e1ec3c,0b6ee20d-6236-49a9-9e53-e94d6c127226,48888aaa-ab58-4bb1-a939-3980d1bf47de,"Hello Loretta, your blood work shows slightly low vitamin D. I'm prescribing a supplement.",True,,,40f1cf40-4135-4a6d-afda-21188ab17523,,2025-08-17T16:18:18.077808,2025-08-21T02:13:18.077889
5053b78e-ae76-447e-82e1-3f930b1abbb0,750aa5c5-e43b-4940-a655-480c3d025d9d,176b0653-8d84-40ed-a87f-8dedbb962b71,"Hello Christina, the X-ray shows no fractures. Continue with rest and ice, and follow up if pain worsens.",True,,,,,2025-08-25T19:35:18.078470,2025-08-07T17:45:18.078575
721e3533-720c-41ae-a43f-8785da375266,a5ae09fe-29fa-4a3d-9a51-b299bf75bb4e,752a1a28-7252-4f0a-bd0a-063b239e2b9d,"Good afternoon James, the specialist confirmed our diagnosis. We'll start the new treatment next week.",False,,,,e0c9a2b4-3c66-4b9e-aa22-f6b10b8a5517,2025-08-09T08:50:18.078709,2025-08-23T06:42:18.078722
7bf13ca4-d673-4852-be2d-6d7e18c0739b,e4f9158a-84d0-44f7-ae1f-37d7a40d8828,62be23ac-9567-4fb2-8a1a-acd40ba92e2a,"Hi Roberta, I've reviewed your symptoms. Let's schedule a follow-up in 2 weeks to reassess.",False,,,,,2025-08-06T06:51:18.078925,2025-08-02T06:22:18.078938
4c7fc172-6fe2-4a39-8d09-4e2c5b07ec05,92841ae9-15b1-4ac0-8c07-5ed2bc584b61,e4d317c2-563c-4345-99ef-1ff805482094,"Good afternoon, I'm having trouble sleeping since stopping the ambien. Any suggestions?",True,,,cb8511a2-324b-45fd-91ed-6b0ee9d64be3,,2025-07-31T17:53:18.079019,2025-08-03T04:09:18.079035
51e498f9-c246-4655-8031-fccd89df9edf,809382d4-bbc1-4e0b-8dc0-444672484a9c,c76b3ea1-fa14-412c-9eb5-151836cb10de,"Good morning, I'm traveling next month and need refills on my medications before I leave.",False,,,,,2025-08-26T16:16:18.079159,2025-07-29T19:00:18.079170
7af12a5d-e032-446b-9a76-c87f12b4e8d2,96588611-2650-40bb-adb9-73ca7c187bc5,7ebefb65-6beb-4a77-aa81-32017695e371,"Good afternoon Sandra, the specialist confirmed our diagnosis. We'll start the new treatment next week.",False,,,,,2025-08-18T06:56:18.079668,2025-08-15T09:36:18.079688
169e6ab9-c8dc-4e2e-8ee0-fa5a28a22218,8f2f6411-b9e7-4876-b1f8-d3b44089bfdf,59e6db05-1e03-4972-b035-6578ed5858f8,"Good afternoon, I wanted to follow up on our discussion about my sleep issues. The CPAP isn't helping much.",False,,,70ce127a-68f7-4069-88e3-3dabf0737bd0,0640345c-a889-4bfd-abee-0fa466ee736d,2025-08-12T22:50:18.079912,2025-08-04T07:55:18.079930
a66b0ce6-149e-42bc-8273-515b35f0428c,b916e0d7-cd5f-4673-a844-583bc66fbfe4,4018f628-e992-4565-bccb-ebe9342eee76,"Good afternoon Gregory, the specialist confirmed our diagnosis. We'll start the new treatment next week.",True,,,,,2025-08-23T08:23:18.080137,2025-08-26T15:05:18.080149
b4f85b06-9fa5-460f-aa0f-81a17cf6a346,34155bb7-b04e-43a1-9143-c72a1744643f,0c334695-5f14-4ffd-882a-38948ee8a738,"Hi, I've been following the diet plan we discussed and lost 8 pounds so far!",True,,,4c6470a8-f0f4-410e-a4a9-ea64d2a01d31,,2025-08-10T18:00:18.080375,2025-08-09T12:33:18.080398
57b7c0e8-5a0c-417b-b970-867a8412a9cf,e2ecf6a6-014d-43e7-b6c0-d47a0842c136,47ec0d7e-c079-4e69-b7ba-10cff3e64c93,"Hello Tina, your lab results look good overall. Your A1C has improved to 6.8%. Keep up the great work!",False,,,,,2025-08-08T23:53:18.080528,2025-08-12T12:41:18.080540
5b06886f-832e-4082-ae6c-13ed7c2f1d59,06122a32-4d6e-472b-b43d-3a590a7ac693,1c586a74-1cfe-485a-ab6f-08669d54096a,"Good morning, I'm traveling next month and need refills on my medications before I leave.",True,,,,,2025-07-30T13:56:18.080723,2025-08-26T23:54:18.080735
d86a411f-2834-4dce-8214-29b654320c9d,d0c3976a-d0fb-42ea-963e-152eeae00065,77b6a8cf-abd8-4db2-896f-6676b2a4db9c,"Good morning Drew, the CT scan was normal. I'm glad we could rule out any serious issues.",True,,,,3f55ed01-2d2f-4828-bfc7-65055cc75ff2,2025-07-29T00:39:18.080819,2025-08-13T00:59:18.080831
d2b3ad96-f604-4bdf-80ae-73018e28f0a7,cd54aeaa-fac6-41c6-b7d9-1654220910fb,229451a6-6333-4ba4-b47e-70e8846a1ec2,"Good morning Ricky, I've updated your treatment plan based on today's visit. Check the portal for details.",True,,,b447d899-1888-4355-8ff8-7ce973c53d7b,,2025-08-11T00:06:18.080891,2025-08-13T12:38:18.080901
8b64cf75-b846-414a-94ce-fde56ca66a3a,68d60e18-038f-4b95-ad2f-5c0ee3dbdcd9,3c675e11-9db0-464c-b166-bc2d0f119516,"Good morning Leonard, the CT scan was normal. I'm glad we could rule out any serious issues.",True,,,,,2025-08-06T13:21:18.080969,2025-08-15T21:26:18.080979
78150da2-25fd-4b86-a33a-107c34c4a271,9d2bd006-1939-4ecd-b197-f588026a7f02,6b6bc034-7a5a-496d-a61e-9463a8b80b2c,"Good morning Christopher, the CT scan was normal. I'm glad we could rule out any serious issues.",True,,,,1da6bcf9-4b97-4bdd-bde7-26632a4816f4,2025-08-27T17:04:18.081062,2025-08-11T15:34:18.081073
