message_id,sender_id,receiver_id,message,is_read,previous_message_id,next_message_id,appointment_id,thread_id,created_at,updated_at
a8a489cd-7978-4dc0-82e0-b8e60879c247,d194d40f-4c36-4be1-9a37-2ec6d37cc096,eab9e2c1-4371-4a24-8c17-9f5c864aa9c0,"Hello, I've been having chest tightness when exercising. Should I come in for an evaluation?",True,,,8610a16c-1317-4ca6-93fd-bec54e807c68,,2025-08-26T16:00:17.782429,2025-08-07T22:07:17.782436
cc527055-ad55-4ff3-ad8e-d692c3010a72,37cd364a-71c3-4cbe-9a37-3b14a3e69cb1,9d2bd006-1939-4ecd-b197-f588026a7f02,"Dr. Dr. Martin, my blood pressure readings at home have been higher than usual. Latest was 145/95.",False,,,,,2025-08-09T14:56:17.782509,2025-08-14T05:32:17.782519
7c7ad289-75af-4a36-8001-410c7c174bfa,cbd33fa6-8494-4fea-ab60-251bae451b6d,643e8c4d-f740-4144-b31e-caf0483f4864,"Hello Anne, your lab results look good overall. Your A1C has improved to 6.8%. Keep up the great work!",True,,,,100b02a4-370a-4408-841a-27301e242174,2025-08-09T19:13:17.782617,2025-08-14T05:28:17.782623
2a8f9b31-1aa0-469f-9d3c-6be7b11b92de,c808041f-7816-48b4-880e-8104d5175acc,8bb4d326-6f10-45d8-849e-ff01cfac662e,"Dr. Dr. Burke, I'm concerned about a new mole I noticed. Can we schedule a skin check?",True,,,,,2025-08-16T07:53:17.782745,2025-08-14T05:13:17.782757
1bd15b1e-3a64-4bee-8d87-11cbe5841c6f,ccbb6370-17bf-4c51-a9f7-96b975fb68d2,86fbc436-fdbc-43bf-b3e5-9ed344b6ea9d,"Good morning Dr. Dr. Morgan, I've been experiencing increased fatigue lately. Should I be concerned?",True,,,875be0c5-8578-4d21-9f6f-0d6d58b539ec,364d8603-3e12-42fa-983f-204fbb114709,2025-08-17T06:44:17.782825,2025-08-26T14:05:17.782836
dc4b8fd1-d927-49fe-a1ca-c22dfc83f21e,5d39aa8c-40dc-4109-a937-6d9907d73409,9f964e6c-7ef5-4710-91a3-b20f6870b23c,"Hi Russell, congratulations on your weight loss progress! Let's discuss adjusting your diabetes medication.",False,,,,b7213789-897a-421d-a1ad-599d1dd881c6,2025-08-22T21:43:17.783024,2025-08-07T22:41:17.783058
fddd06ff-25e0-40ab-85e1-894296083154,799f9928-b4bf-4e10-9263-4386bf5f2547,f2d17f56-caeb-4416-b876-9fdcf473e747,"Hello Caitlin, your blood work shows slightly low vitamin D. I'm prescribing a supplement.",True,,,,,2025-08-16T03:42:17.783358,2025-08-06T16:39:17.783373
71a40617-f08c-4a20-9bd4-de6821930f44,65ce042b-fb8e-437d-a73c-98804bc99039,58f1fce2-4264-4591-a391-23d583323299,"Hello Dean, the X-ray shows no fractures. Continue with rest and ice, and follow up if pain worsens.",True,,,6293c05c-fa6d-4a3d-85c3-6ae2929968f1,,2025-07-30T23:38:17.783651,2025-08-23T08:43:17.783674
bcde7d27-1ac9-44d7-b6a5-4733e371510f,4fc086c8-7bf3-45c4-ba90-7384ca8374d6,2d48fe14-3bee-483e-9029-936bc8d8cb1f,"Hi, I uploaded my lab results from Quest. When you have a chance, could you review them?",True,,,,,2025-08-13T07:26:17.783788,2025-08-17T21:10:17.783802
9d1b61b3-e6bd-453d-a414-af73a4cee441,8593a7c1-7f95-4143-8f1a-7b2bfc503530,84ad5746-6623-4303-88da-25fca5c96f88,"Good morning Adrienne, I'm sending over a new prescription for your blood pressure medication.",False,,,eb69922f-91d9-470c-a828-9c14797404b0,,2025-07-30T09:53:17.783967,2025-08-18T10:50:17.783981
5c73f99c-4775-46f7-881e-771d6e4012eb,66c14768-a6f5-4747-805f-be72540f730c,7c84ffc2-4d43-401c-af68-7e54afa17da3,"Hi, I wanted to let you know that the physical therapy is really helping with my back pain.",False,,,10e6fc6a-db5c-434f-860f-d77019dc07af,317d6ce8-3e09-4683-af68-9cd9980cf7b1,2025-08-06T09:51:17.784258,2025-08-04T21:43:17.784277
9d636881-1319-45b4-a110-9528651c1a9c,f451dea9-be78-4c06-adc6-97c533d32901,11e54113-c617-4e3a-ba44-e5de8be6c93e,"Hello Christopher, your blood work shows slightly low vitamin D. I'm prescribing a supplement.",True,,,b344e987-ef70-434a-8c16-dc3dc4db0a20,d6b7c28f-a36c-450c-9dce-c06a0d91f093,2025-08-26T21:17:17.784360,2025-08-16T16:57:17.784373
53631b7e-ccaf-4959-ad00-e3838ac4f31f,75558fd8-ceea-4157-aa2e-0afe4150dd70,474b904e-2d05-49c3-8008-6cbffe531794,"Hello Anthony, your lab results look good overall. Your A1C has improved to 6.8%. Keep up the great work!",True,,,,,2025-08-18T22:51:17.784489,2025-08-20T15:52:17.784497
da1b5fca-de62-495e-95d0-58b80e1dc295,8f77006c-c73d-4c73-800e-4b3466f183ca,34f5171e-6173-4a20-8480-4e557ab39bbf,"Hi Nancy, the side effects you're experiencing should subside in a few days. Call if they worsen.",True,,,,,2025-08-17T10:14:17.784554,2025-08-21T03:48:17.784569
b9c90377-124d-415f-a192-c55907123cc2,1bd1cecf-aea4-47dc-a519-65e83ca96be9,9884d2ce-9358-4cce-8600-291d8fbbd552,"Hello Noah, I've cleared you for surgery. The surgical coordinator will contact you about scheduling.",False,,,,11cde5ff-3276-4088-a1a9-f19a31c8b8e2,2025-08-14T22:10:17.784718,2025-08-07T22:33:17.784729
aee89778-f80a-46d0-b15c-227b82f15604,0c912924-813a-4df3-b8bd-18bddf08dfe4,ed7a1dde-d7aa-4d9e-be36-9307f3a1293e,"Good morning Mary, I'm sending over a new prescription for your blood pressure medication.",False,,,,aa6453cd-b2c0-49dc-9ee8-ed9b074d995b,2025-08-26T23:07:17.784808,2025-08-15T11:19:17.784822
e9e7552c-6a12-4eee-9791-1c4308679b22,f6d548a0-24fa-4548-bfab-56da9377e60b,93c46b4b-0711-486e-99e1-8c02660afe08,"Hi Shannon, your blood pressure is well controlled. Continue current medications and lifestyle changes.",True,,,fb1ac145-75d0-402c-b65c-ffe1c9e57431,,2025-08-22T19:09:17.784902,2025-07-28T17:28:17.784915
0f4f283d-110f-40ae-bcd0-dc32c6098490,d5574354-c4dd-4fbf-bc4e-7666dfb12644,823f5ebe-5827-4d31-bd8d-10a0bd12515c,"Dr. Dr. Frederick, my blood pressure readings at home have been higher than usual. Latest was 145/95.",False,,,,,2025-08-14T23:22:17.785081,2025-08-14T02:56:17.785111
9721d46a-7e7a-46c4-b8a1-c468691d2e38,422f8f09-8850-403e-b0d0-403e833defa4,dc13dba4-83bf-44da-8acb-893f075d5ff1,"Hi David, congratulations on your weight loss progress! Let's discuss adjusting your diabetes medication.",True,,,,,2025-08-27T01:42:17.785214,2025-07-29T18:32:17.785232
a830feb6-6a4e-49a4-b6bb-08b29db3eb32,73024999-b36c-42d7-a7e5-e586e9b52274,a66d01e2-fa99-4677-a01c-bb97e306e7e4,"Hello, I've been tracking my glucose levels as you suggested. They're ranging from 110-140. Is this okay?",True,,,,,2025-08-26T16:48:17.785453,2025-08-04T06:18:17.785483
700c840f-40c5-4b4f-b1e5-df4dc7ae7699,34155bb7-b04e-43a1-9143-c72a1744643f,d92dfa69-401f-4505-8e41-8bfeb6496516,"Hello, I've been having chest tightness when exercising. Should I come in for an evaluation?",True,,,,,2025-08-27T18:53:17.785986,2025-08-02T23:58:17.786039
13dc8960-a727-4d51-8b7a-ab27bdea290f,0eddc349-19cb-4d30-ad7e-44e261f24542,0998e996-f11b-4880-bca5-420cae697b8d,"Hello, I've been having chest tightness when exercising. Should I come in for an evaluation?",False,,,,,2025-08-01T18:03:17.786329,2025-08-15T13:13:17.786364
f75abf92-732b-44d1-a130-58bbba634811,c9c46dc5-23ce-44df-94a2-128a6157dcb3,0f931f22-9f97-4716-884e-882b9db9af68,"Hi, I need to reschedule my appointment next week due to a work conflict. What availability do you have?",True,,,,,2025-08-02T01:03:17.786589,2025-08-06T17:13:17.786625
72324aa4-8d76-47d2-9188-050cf0f538ec,e9d2cf97-dd9a-4300-b295-9e6bca0b7b5e,745e038d-d52e-4c0a-87b1-ae41ad0b240c,"Hi, I need to reschedule my appointment next week due to a work conflict. What availability do you have?",False,,,,2bf84564-c4fd-431f-aa09-17b39ec0feb2,2025-07-31T05:06:17.786860,2025-08-17T16:07:17.786888
8bf23e8d-29ef-4149-acbd-419f2e1902d9,f3a3c2c0-0880-4002-a6f0-be1723e0be63,1b9ec0d0-10b2-4e21-95ed-e7de2c6aa113,"Good morning Ellie, I've updated your treatment plan based on today's visit. Check the portal for details.",False,,,,ddbc85a3-edf1-4ae9-8595-1d712bee86cb,2025-07-28T22:53:17.787030,2025-08-12T05:44:17.787050
c9b48c06-c23a-41be-9acf-c82d9dd84968,1fdabe65-b47b-4dca-8981-464891fad2e5,3a56aaa8-ef7b-4b8c-8a5c-5a9c930e3271,"Hello Olivia, the X-ray shows no fractures. Continue with rest and ice, and follow up if pain worsens.",False,,,c8d7eabf-d5d8-4ad5-bffe-2c4c9d1e1b7b,,2025-08-10T19:25:17.787149,2025-08-24T08:07:17.787165
8f8771b1-9157-4b3e-9f9b-a888bb5a7290,ba8199e0-9078-4bcb-8ec0-f57e562cf843,2d4dc10f-015a-41c9-a485-b02633a94c79,"Good afternoon, I'm having trouble sleeping since stopping the ambien. Any suggestions?",True,,,,ed6460a6-5ead-48a3-9d47-fb40171098a6,2025-08-13T07:21:17.787376,2025-08-23T11:57:17.787401
3f029e29-73d5-4dc2-aa61-2cdb0fd350ac,7efb5ff8-12ed-4fb0-8bd3-3e1ed503f98b,90721532-0877-46a1-8320-efb9c11057c8,"Hi Shawn, your cholesterol panel shows improvement. Continue the current statin dose.",True,,,0806dde0-0962-40a8-9e1b-28bade35a25e,,2025-08-03T03:49:17.787589,2025-08-10T08:15:17.787604
0109b6ce-6f63-487c-be5c-6d2f086d6612,8518595e-f1ed-4d77-afc2-5221ab16542a,99a37fda-d746-4b1a-8ad2-c898fb3911aa,"Hello, I've been having chest tightness when exercising. Should I come in for an evaluation?",False,,,db511ea7-fa70-4ea9-8e76-d4f6c0ac71f0,b4e8bf9b-d600-4842-b86b-b32eaeb05a30,2025-08-05T05:36:17.787678,2025-08-08T08:18:17.787691
bebe7829-1ef0-4152-935a-bebe749322ba,f4bbeade-caea-4ece-92be-4135b92b0660,eb01d747-7e34-465b-9a9c-2672cc517614,"Good morning Rodney, the CT scan was normal. I'm glad we could rule out any serious issues.",False,,,510a91a2-3348-4996-b196-dd11fe4c6a9b,,2025-08-11T06:38:17.787756,2025-08-04T11:40:17.787768
6ad3d451-cadd-4499-8ec7-e982577def27,9ab2cc5c-7999-426c-bb05-a23ebc103928,2df2143e-d975-4600-8d82-af1398d40b8a,"Hi, I uploaded my lab results from Quest. When you have a chance, could you review them?",True,,,61351f71-4da0-43f3-976c-6903eaa11886,,2025-08-06T00:03:17.787880,2025-08-08T23:13:17.787895
81c29cca-ced3-450e-8a8c-45f6f342b93b,323933e1-2ed8-4e9b-a3eb-e05cbcf43bca,3acd7e6a-48c1-403e-916c-b6bfd106cd7e,"Hi, I need to reschedule my appointment next week due to a work conflict. What availability do you have?",True,,,,,2025-08-18T09:25:17.787997,2025-08-20T07:22:17.788010
f224b615-5f61-4710-8ccc-24e88a20c8aa,d5b86f58-a1b2-4662-90c3-6ad505ee1484,56d1830c-0bf3-47af-b9eb-d80b033b0f83,"Hi Lisa, the side effects you're experiencing should subside in a few days. Call if they worsen.",False,,,,50a5249f-d8fb-4ba0-b960-a502ade5a817,2025-08-01T16:15:17.788726,2025-08-16T09:47:17.788780
71c035c2-faf4-4d3f-a07b-5102f8f73864,9ea1de8a-88cd-4082-99c2-0641b3463f42,c19ea6d0-5235-4865-a9d0-ced3bb89f5e6,"Good afternoon Mark, the specialist confirmed our diagnosis. We'll start the new treatment next week.",False,,,,,2025-08-28T12:58:17.789438,2025-08-15T02:19:17.789477
3f278034-719a-41f6-89f1-86aa2f1637ba,ee2788bb-fc0c-4239-a42e-5c803bab0111,6da94beb-5aa4-44ae-92db-540c1f4e017b,"Good afternoon, I'm having trouble sleeping since stopping the ambien. Any suggestions?",True,,,,,2025-07-28T23:40:17.790067,2025-08-21T22:40:17.790105
f905e65a-fcc0-4374-bdc9-e43585365bf6,bfed0299-cd65-450c-a22e-bce1ab2b2de3,849e320a-40a8-4830-8f89-8261e58e75db,"Good afternoon, I wanted to follow up on our discussion about my sleep issues. The CPAP isn't helping much.",False,,,d9799e0d-d8d1-4877-862c-5cb10ca4a857,,2025-08-26T01:11:17.792858,2025-08-28T12:16:17.792907
f1f8c00f-ae31-4249-ba82-961f27e3d2d5,57853561-37f1-4970-a13e-647d6cb37b5d,e2f53660-b64d-4e0e-bde2-3ad610ad1a4c,"Hello Harry, your mammogram results are normal. Schedule your next screening in one year.",False,,,,,2025-08-13T19:05:17.794341,2025-08-25T23:11:17.794524
3df175fc-6d9c-4199-afd3-5471b8674df0,85e8aed1-8b87-4f59-944a-ee85cbc1faa9,790068c5-8e43-4db2-880d-2108d8f0bce1,"Good morning, I'm traveling next month and need refills on my medications before I leave.",True,,,f073f43d-d614-4ba4-82d5-972c31a6a3bf,,2025-08-16T07:37:17.795032,2025-08-06T20:06:17.795062
55e8cca1-87b9-485e-bcd7-11eab5fef79f,53e61515-7373-40a5-ad4e-e0251b8849f9,ccbb6370-17bf-4c51-a9f7-96b975fb68d2,"Good afternoon Richard, the specialist confirmed our diagnosis. We'll start the new treatment next week.",True,,,,,2025-08-07T22:14:17.795395,2025-08-03T02:25:17.795492
4cbaf72f-6e9f-4417-b66c-80e871109b2e,f3554342-2148-45dc-be54-ffdafac99bb0,8832471b-8e1d-4f07-ac15-31c447e5167d,"Hi Dr. Dr. Goodwin, my pharmacy says they need a new prescription for my Lisinopril. Can you send it over?",True,,,6b1b5d55-be35-4cfc-92f2-04e266a807b6,,2025-08-18T01:42:17.796627,2025-08-23T06:32:17.796764
1ac11cfd-af1e-478c-8548-8d69a03eef98,3e34056e-9592-419b-b10f-728269a03449,7b1d0d8c-1da2-4c5e-807b-989210f8c7fa,"Hi, I've been following the diet plan we discussed and lost 8 pounds so far!",True,,,,,2025-08-20T16:06:17.797545,2025-08-23T16:39:17.797681
0c5edffd-db7b-4b9a-a05a-de4985a24212,9d7216a7-8e31-460c-a2f4-0b4dac0ebea2,4568dc12-98a5-40d3-8693-0dac208c5688,"Hi Bryan, I've reviewed your symptoms. Let's schedule a follow-up in 2 weeks to reassess.",True,,,,,2025-08-02T12:39:17.799382,2025-08-16T21:09:17.799458
2171565b-41da-4617-9c17-2e223300b566,e5da8d42-edaa-4479-bbde-e83123b9fbf4,1ad0b0ac-dedd-4e61-899a-76795faa4514,"Good morning Penny, I'm sending over a new prescription for your blood pressure medication.",False,,,80caa768-5654-404f-b71e-db93690fba67,,2025-08-09T08:07:17.800691,2025-08-17T21:52:17.800737
55c5f027-d195-4e94-94dd-73be72e367b1,26bacb6b-f66d-4d2d-80ac-ac1be28c639c,63420362-d030-42c7-b700-a79def8cf40e,"Hi, I uploaded my lab results from Quest. When you have a chance, could you review them?",True,,,6aa902f6-727e-4bc1-ab4f-b73f718d6b78,,2025-08-17T21:40:17.801040,2025-08-14T14:52:17.801057
0732337d-8c7f-4a27-b195-f2c38408df97,9dfb21d1-5154-41d9-a5fa-679b00057c3b,8a7797a4-410c-4c73-bae6-b31033d2a108,"Good afternoon Patrick, the specialist confirmed our diagnosis. We'll start the new treatment next week.",False,,,,,2025-08-01T19:02:17.801745,2025-08-20T04:25:17.801791
2616949e-daad-4502-a2a0-1fbd8d8e3e68,a367ba5f-dbb3-46ba-9382-c6614fe6a846,483e12f3-346e-495d-bde4-d42035cfa2c8,"Hi, I wanted to let you know that the physical therapy is really helping with my back pain.",False,,,,76eb0cad-9faf-4404-80b7-40591fc0ce96,2025-08-11T02:16:17.802169,2025-08-21T18:09:17.802194
04016ac8-bf24-46b9-bac4-365b6841c87b,335e40a7-71cf-4aee-a89c-520672f790c8,322edafc-5c7b-444f-b5e5-87595010a182,"Good afternoon, I wanted to follow up on our discussion about my sleep issues. The CPAP isn't helping much.",False,,,,,2025-08-25T13:22:17.802463,2025-08-08T09:28:17.802485
cfef1d66-e4d1-47f0-955e-2ef1f276abd2,af094f65-03c1-46c2-9661-2349b6218a7a,afca7e73-bd81-4d25-921a-fde086500253,"Hi Dr. Dr. Jensen, my pharmacy says they need a new prescription for my Lisinopril. Can you send it over?",True,,,,0421fc40-733e-46d7-9f7b-ff72a511f5bc,2025-08-14T03:39:17.803142,2025-08-22T08:47:17.803179
9e723cbd-134f-42f0-99d7-89826ce8684d,266e78a0-cd30-4f93-8d59-28a384d55d34,e68da380-06ac-473d-90dc-65382e813031,"Hi Allen, your blood pressure is well controlled. Continue current medications and lifestyle changes.",True,,,d07a0122-3fae-4df1-aa36-12d8ff659818,2a10668a-0913-4d61-90e4-038e778a2949,2025-08-02T03:47:17.803333,2025-08-02T13:53:17.803355
e181a67f-06d9-44c8-a7ba-973eae7fb0c0,c0cafbd8-6fe2-49a7-ad99-bbfeb0842f29,72e30790-96d3-4697-a4f6-34fa39c59640,"Hi, I need to reschedule my appointment next week due to a work conflict. What availability do you have?",True,,,4e838f49-cd71-4693-a186-70e022618b11,,2025-08-06T11:33:17.803614,2025-08-27T17:06:17.803645
a92c6e64-0a14-4fc2-8496-218ba1df46bc,047eae56-fd22-43bc-8b28-eb0ed9bdc1d0,aaa75760-be6c-482a-8352-1ec14128d11b,"Dr. Dr. Bell, I'm concerned about a new mole I noticed. Can we schedule a skin check?",True,,,,,2025-08-01T21:48:17.803726,2025-08-16T17:24:17.803744
b913bbf7-8733-43c1-8ad3-c180a99e9408,187bdfad-f8e4-4e56-b91d-d9e9987ded00,d818fbf0-92c7-417d-832c-cfadd487d517,"Hello Malcolm, the X-ray shows no fractures. Continue with rest and ice, and follow up if pain worsens.",False,,,522a18a1-bab3-4597-92f7-1d1cd2615afb,,2025-08-11T10:37:17.803843,2025-08-19T05:13:17.803868
110fca96-118d-4a62-8299-d84698efe390,65fe5006-b230-47c9-a2f9-e68007127168,e3dd114f-aff0-4ddf-a02c-63707581b961,"Hello, my insurance approved the MRI. When would be the best time to schedule it?",True,,,,,2025-08-06T03:18:17.804521,2025-08-24T02:20:17.804558
17d52fb7-636e-46ea-8012-add03cf6fef6,d0c3976a-d0fb-42ea-963e-152eeae00065,eac2dabf-4fcb-4b10-b306-44991ba46a9b,"Hello Paul, your mammogram results are normal. Schedule your next screening in one year.",True,,,,,2025-08-14T07:57:17.804645,2025-08-16T05:49:17.804665
37f0774b-55db-453e-88be-c1a5b6799ff1,26721902-f535-4de0-88ea-5cb0d556cfa1,60bd70b7-1595-4b9b-a3a6-c7085435b2be,"Good morning, I'm traveling next month and need refills on my medications before I leave.",False,,,,,2025-08-17T15:40:17.805009,2025-08-12T07:52:17.805034
beaac146-383a-4d61-bf44-0750d323a9a5,450bd99f-2965-4dc6-9b01-961b1f2a7e92,48595822-d23f-4742-8b8f-c4cbd19f0919,"Hi, I've been following the diet plan we discussed and lost 8 pounds so far!",True,,,,,2025-08-18T10:00:17.805247,2025-08-22T14:09:17.805259
8f5d63e2-1d81-4f58-850d-f9b363fca28a,55181a79-990b-4cee-969c-4ab28aa5dbd5,32a12b7f-e739-4f47-9495-b8c6ec19cb91,"Good afternoon, I'm having trouble sleeping since stopping the ambien. Any suggestions?",True,,,,477a7849-6f53-4a91-8b53-70f40dcec719,2025-08-04T19:27:17.805403,2025-08-08T20:34:17.805474
d590708d-a4ad-484d-ad2e-b39c08187849,8b675697-8941-4a92-8cc1-24da7a8e1041,0def5865-3c0c-47a5-b458-520b67572466,"Hello Amanda, I've cleared you for surgery. The surgical coordinator will contact you about scheduling.",False,,,,78d67c15-6804-48ff-9a60-f1aec31dcf23,2025-07-28T20:35:17.805576,2025-08-17T15:12:17.805590
b24c1458-3e16-45c8-87d2-ae454f8f2ba3,5bd60e1c-a321-4849-bd36-658870070f4f,be833a11-099f-436d-a745-4b1f2d48e102,"Hi, I uploaded my lab results from Quest. When you have a chance, could you review them?",False,,,,,2025-08-02T16:01:17.805721,2025-08-12T10:27:17.805737
164ab4f4-6a96-4728-af6c-db8066f53743,82b8cd1a-fc7f-447f-bbd9-cf240b1b5335,67610bee-c516-4dfd-b56f-fe8613ce2726,"Dr. Dr. Robinson, I'm concerned about a new mole I noticed. Can we schedule a skin check?",True,,,,ca5de6e2-4ffb-4030-a3c1-1e8b9d5d6391,2025-07-31T14:36:17.805820,2025-07-30T05:47:17.805835
f14e9aad-8add-4d04-bcd2-154d0288a7b7,7a992dcc-1bb7-46e5-9364-3d54b877d719,e9d2cf97-dd9a-4300-b295-9e6bca0b7b5e,"Good morning Kimberly, the CT scan was normal. I'm glad we could rule out any serious issues.",True,,,,3c3d4cac-0e41-4f12-a245-5c12709c1f55,2025-08-10T18:26:17.806254,2025-08-16T15:08:17.806303
99645d20-c406-4c66-b8a6-4fe7f855960e,f18445b0-e487-4294-b961-4461097c340e,4ca7d4ef-0f33-40b3-aee6-6c9a9ae1fcb6,"Hello Haley, your mammogram results are normal. Schedule your next screening in one year.",False,,,,,2025-08-01T16:02:17.806741,2025-08-15T13:48:17.806775
e4444eff-9a82-4be8-b6f4-d40a038b2aa8,14bb111a-692d-49b9-b793-0fac8b641646,509e7962-9ae1-4766-aadb-6461735fc0da,"Hi, I've been following the diet plan we discussed and lost 8 pounds so far!",True,,,,,2025-07-29T20:53:17.806874,2025-08-04T23:33:17.806898
416f9b65-cede-488b-9dfc-4f5aa74f292c,5b0ca5a4-49f3-4e6e-8395-42732f60bdf5,78cd80e1-7827-448d-90a8-67196d8bfe84,"Hi Callum, congratulations on your weight loss progress! Let's discuss adjusting your diabetes medication.",True,,,,,2025-07-31T07:18:17.807076,2025-08-28T11:38:17.807100
e7acb995-3cf0-4918-a466-8562a6a1c8e7,d5934104-468c-4714-ac1e-cf70c7f13971,04392828-c5e4-4be6-be79-203eb22f56b4,"Hello Steven, your blood work shows slightly low vitamin D. I'm prescribing a supplement.",False,,,,,2025-08-24T09:33:17.807408,2025-08-06T09:31:17.807430
fdcf1521-7c6d-4c91-8d72-dd252ab5c311,05e97ad1-b745-42b2-9323-2ada88029ddc,e3dd114f-aff0-4ddf-a02c-63707581b961,"Hi, I need to reschedule my appointment next week due to a work conflict. What availability do you have?",True,,,,3d63f17e-e327-4af1-a9b4-d97804f88ee0,2025-08-05T19:28:17.808478,2025-08-02T00:06:17.808554
caba84b6-f88c-4298-bcd7-c46295554d18,a23bbfb1-7174-4cc2-9eee-f813fed6e07c,7e038380-622f-4c7d-8885-856a8fd06e95,"Good morning Denise, the CT scan was normal. I'm glad we could rule out any serious issues.",False,,,,,2025-07-30T06:25:17.808783,2025-08-06T18:14:17.808805
0895901d-f2b0-4017-bf64-31249a94120b,b09bd8ba-2d1c-4475-8f5f-040e69ed2783,cdeb2ff8-d5c6-4eb0-b5b2-31ff6beeec05,"Hello, I've been having chest tightness when exercising. Should I come in for an evaluation?",True,,,a8a00ea6-d34a-4460-8c8b-da7aad29e6f2,,2025-08-03T06:42:17.809086,2025-08-20T10:27:17.809117
bc8267bf-f4f2-42eb-8317-6d9a5e5cdbb0,c76fb7c3-0c61-42b9-b1fb-feae2426f821,bb8701d7-d446-4737-a21c-6e72c4938a0c,"Hello, I'm having some side effects from the new medication - mild nausea and dizziness. Is this normal?",False,,,,,2025-08-12T14:30:17.809401,2025-08-06T13:12:17.809417
467892e5-342e-40be-bf12-7acea1de22a1,f55d0cda-75f3-4bf7-a130-118b40e08ce8,358f3083-fb25-4cc1-a129-02d844e5f2aa,"Hi, I need to reschedule my appointment next week due to a work conflict. What availability do you have?",True,,,6c2bddfd-08d7-4580-9c7b-c40baed54894,f0ba89b6-0706-4508-9d22-6df222a8fee2,2025-08-22T15:01:17.809658,2025-08-20T21:19:17.809677
12ece4b5-032e-4055-876e-410159e7d855,9f486351-2459-4a8c-ab23-c514100ad9ae,c76b3ea1-fa14-412c-9eb5-151836cb10de,"Dr. Dr. Brown, I'm concerned about a new mole I noticed. Can we schedule a skin check?",True,,,,,2025-08-06T17:07:17.810427,2025-08-02T06:34:17.810587
db34fd32-8306-414b-b8ce-fbd8b6690531,4b597f17-f73e-4d44-86a0-df0545bc185e,00dd9ace-ee2d-401f-8db3-703313ef073a,"Hi, I've been following the diet plan we discussed and lost 8 pounds so far!",False,,,,,2025-08-24T10:43:17.811084,2025-08-16T04:10:17.811129
e5c0418e-d3d0-4f55-b41f-718ec638edb8,3eb897b1-b1b8-43c4-a27a-0262bbe26e3d,2fa00c34-ffd4-42f7-9c7f-c53355c849fd,"Good afternoon Melissa, the specialist confirmed our diagnosis. We'll start the new treatment next week.",False,,,4ddc3b3b-150e-41c2-9bd2-15daa9bc22c3,6bc60948-5a2d-4103-9756-15c6ef34cf76,2025-08-18T21:58:17.811892,2025-08-25T08:41:17.811929
fa47a05f-2d07-491a-8aca-4063956591eb,c152a823-7bd8-4b53-9c49-41c5d88674ee,4b4a3dab-15eb-4a80-bd2c-a98025a42e6d,"Hello Joshua, I've cleared you for surgery. The surgical coordinator will contact you about scheduling.",False,,,,,2025-07-31T10:17:17.812305,2025-08-20T22:27:17.812336
9ed41aa2-1cf8-47e0-a001-bbbe9236739c,cde3d86d-dd23-4f0f-85d4-c4ac7f786e96,733adafe-5b27-4c0a-88e9-57e42b6504a9,"Hi, I wanted to let you know that the physical therapy is really helping with my back pain.",False,,,,,2025-08-08T07:12:17.812465,2025-07-31T22:15:17.812482
f5f10120-9503-4d13-8a04-ecc0460132bf,82e4ac6f-e5c3-464d-bf42-66320be6ccb6,3da6db54-57a3-41a6-b9af-fca9e09b26dc,"Good afternoon Bradley, I've referred you to cardiology for the stress test we discussed.",False,,,6582c871-cfc1-4bfe-a738-d8ebc627a67b,,2025-07-29T07:50:17.812766,2025-08-06T14:01:17.812786
a05c0ab4-46e5-45f2-89ce-a6ac763d0137,48888aaa-ab58-4bb1-a939-3980d1bf47de,c8ce65ca-79b7-4e86-8d79-f77325aa250d,"Dr. Dr. Benton, I'm concerned about a new mole I noticed. Can we schedule a skin check?",False,,,,,2025-08-11T09:01:17.813023,2025-08-06T09:03:17.813039
fafc83c2-aa2c-40f4-9025-802ebf37a4f0,42ee9f82-e262-484e-8cf7-02a147ec9a6c,3322fa91-0dde-48ef-82b3-ddc12fcf7623,"Dr. Dr. Vaughan, my blood pressure readings at home have been higher than usual. Latest was 145/95.",False,,,,,2025-08-25T13:16:17.813175,2025-08-23T10:16:17.813190
d39a5813-db3f-441c-8317-a5b212036332,5ab8b376-3598-47c0-86b9-11e50315cae5,6dcc1a61-0e8a-4a4a-a672-03d8b9cba180,"Good morning Dr. Dr. Hall, I've been experiencing increased fatigue lately. Should I be concerned?",True,,,144f4991-47c3-4529-b168-9cee2a27c029,16075613-684f-4043-8414-3a61622f8c36,2025-08-25T05:05:17.813424,2025-07-28T21:09:17.813438
6874c285-aa90-468b-a236-862140108e51,17391bd8-b2fc-4e18-8aa9-38443bc03a3e,8b8e8728-1ce3-4f67-bb7a-8ab2efda8303,"Dr. Dr. Ramirez, I'm concerned about a new mole I noticed. Can we schedule a skin check?",True,,,,,2025-08-16T00:02:17.813527,2025-08-10T10:01:17.813537
5b6e9d06-c786-466c-8a9f-63cd4ba19ebf,400ad459-db47-48c2-8395-3c03fe94350e,a67f0e4a-abd3-4fb3-91c4-a0f2ce3452a2,"Dr. Dr. Atkinson, my blood pressure readings at home have been higher than usual. Latest was 145/95.",True,,,d901db8b-9e60-41a8-9306-6a34077b0b75,,2025-08-22T20:33:17.813807,2025-07-29T19:18:17.813820
de26cca6-0a84-4a1a-986f-bb36692bc50a,89445c1a-5a2d-47f2-8d60-a5fc29cf0cac,3e34056e-9592-419b-b10f-728269a03449,"Hello James, the X-ray shows no fractures. Continue with rest and ice, and follow up if pain worsens.",False,,,,,2025-08-19T01:24:17.813866,2025-08-27T08:56:17.813878
a68c2e95-ba13-46f1-acd5-d90451c0aa69,47673a55-980a-42bb-8ccc-4c61841641b1,cbd33fa6-8494-4fea-ab60-251bae451b6d,"Good morning, I'm traveling next month and need refills on my medications before I leave.",False,,,,,2025-08-26T04:57:17.813939,2025-08-15T16:12:17.813949
a9c1a60a-2e8b-41c8-bd12-d0a95dad4f21,6d349121-8d95-4f6d-99fc-52d570f5ca5f,790e8206-8fbb-416a-87c4-f301db372eb0,"Good afternoon William, I've referred you to cardiology for the stress test we discussed.",False,,,a8a00ea6-d34a-4460-8c8b-da7aad29e6f2,,2025-08-17T23:52:17.814046,2025-08-15T08:24:17.814057
d1a4e37d-b1f0-4121-a4f4-cc756400e1fa,f451dea9-be78-4c06-adc6-97c533d32901,95d9563e-4b4c-4ccf-839a-2783995fb2df,"Hello Gary, your mammogram results are normal. Schedule your next screening in one year.",True,,,d6dfdc41-c727-48d8-881a-021d64ea7230,997464f8-08ca-47d3-a57b-003e9c2adc8d,2025-08-26T19:06:17.814149,2025-08-18T16:34:17.814160
12e9931f-1b5f-4bfe-93d9-f3b419122439,b1bcb97f-19ae-4f3d-bc4e-70a43794ccdd,9aad1b90-61de-414d-903a-e8a5d386f272,"Hi, I wanted to let you know that the physical therapy is really helping with my back pain.",True,,,,,2025-08-05T23:35:17.814269,2025-08-21T12:31:17.814282
2dc6de83-9640-450c-ada3-28895d05f8fa,bcb37807-e020-411d-aa60-ace826b5db95,21873140-3c93-4367-8ea2-52ec99ce91e9,"Hi, I uploaded my lab results from Quest. When you have a chance, could you review them?",True,,,bd9e1b06-dde7-4c75-85bb-68ca8630051b,d1040990-69f7-4bad-b5f4-8997cfb4871b,2025-08-13T17:11:17.814338,2025-08-13T08:30:17.814349
